ticker,name,market,locale,primary_exchange,type,active,currency_name,composite_figi,share_class_figi,last_updated_utc,cik
BEAGR,Bold Eagle Acquisition Corp. Right,stocks,us,XNAS,RIGHT,True,usd,,,2025-12-02T07:05:58.604123936Z,0001852207
BEAGU,Bold Eagle Acquisition Corp. Units,stocks,us,XNAS,UNIT,True,usd,,,2025-12-02T07:05:58.604124397Z,0001852207
BEAM,Beam Therapeutics Inc. Common Stock,stocks,us,XNAS,CS,True,usd,BBG00KXC8646,BBG00KXC8655,2025-12-02T07:05:58.604124678Z,0001745999
BEAT,"Heartbeam, Inc. Common Stock",stocks,us,XNAS,CS,True,usd,BBG012F6HZX2,BBG012F6HZY1,2025-12-02T07:05:58.604124818Z,0001779372
BEATW,"Heartbeam, Inc. Warrant",stocks,us,XNAS,WARRANT,True,usd,BBG012XPRXX4,,2025-12-02T07:05:58.604124938Z,0001779372
BEDU,"Bright Scholar Education Holdings Limited American Depositary Shares, each representing four (4) Class A Ordinary Shares",stocks,us,XNYS,ADRC,True,usd,BBG00GGXGNN1,BBG00GGXGNP9,2025-12-02T07:05:58.604125068Z,0001696355
BEDZ,AdvisorShares Hotel ETF,stocks,us,ARCX,ETF,True,usd,BBG0106XYDN8,BBG0106XYFH0,2025-12-02T07:05:58.604125199Z,0001408970
BEEM,Beam Global Common Stock,stocks,us,XNAS,CS,True,usd,BBG000BBJG06,BBG001S7JC04,2025-12-02T07:05:58.604125319Z,0001398805
BEEP,Mobile Infrastructure Corporation Common Stock,stocks,us,XNAS,CS,True,usd,BBG0104PDLN2,BBG0104PDMH7,2025-12-02T07:05:58.604125459Z,0001847874
BEEX,The Beehive ETF,stocks,us,XNAS,ETF,True,usd,BBG01R71KKD8,BBG01R71KLC7,2025-12-02T07:05:58.604125609Z,0001722388
BEEZ,Honeytree U.S. Equity ETF,stocks,us,XNAS,ETF,True,usd,BBG01K0VKY08,BBG01K0VKYW3,2025-12-02T07:05:58.60412575Z,
BEGS,Rareview 2x Bull Cryptocurrency & Precious Metals ETF,stocks,us,BATS,ETF,True,usd,BBG01S57TS58,BBG01S57TT47,2025-12-02T07:05:58.60412587Z,
BEKE,KE Holdings Inc. American Depositary Shares (each representing three Class A Ordinary Shares),stocks,us,XNYS,ADRC,True,usd,BBG00W9L9LX1,BBG00W9L9N03,2025-12-02T07:05:58.60412599Z,0001809587
BELFA,Bel Fuse Inc,stocks,us,XNAS,CS,True,usd,BBG000C28YR9,BBG001S6BRZ3,2025-12-02T07:05:58.60412611Z,0000729580
BELFB,Bel Fuse Inc,stocks,us,XNAS,CS,True,usd,BBG000DYGCS6,BBG001S93K81,2025-12-02T07:05:58.604126231Z,0000729580
BELT,BlackRock ETF Trust iShares U.S. Select Equity Active ETF,stocks,us,XNAS,ETF,True,usd,BBG01NC45LW9,BBG01NC45MS2,2025-12-02T07:05:58.604126351Z,0001761055
BEMB,iShares J.P. Morgan Broad USD Emerging Markets Bond ETF,stocks,us,BATS,ETF,True,usd,BBG01F749Y32,BBG01F749YY8,2025-12-02T07:05:58.604126491Z,0001100663
BEN,"Franklin Resources, Inc.",stocks,us,XNYS,CS,True,usd,BBG000BD0TF8,BBG001S5P3W6,2025-12-02T07:05:58.604126792Z,0000038777
BENF,Beneficient Class A Common Stock,stocks,us,XNAS,CS,True,usd,BBG00KFV0B41,BBG00KFV0B50,2025-12-02T07:05:58.604126922Z,0001775734
BENFW,Beneficient Warrant,stocks,us,XNAS,WARRANT,True,usd,BBG01FVBG8K9,,2025-12-02T07:05:58.604127112Z,0001775734
BENJ,Horizon Landmark ETF,stocks,us,ARCX,ETF,True,usd,BBG01RXYQ4R2,BBG01RXYQ6C3,2025-12-02T07:05:58.604127242Z,
BEP,Brookfield Renewable Partners L.P.,stocks,us,XNYS,CS,True,usd,,,2025-12-02T07:05:58.604127363Z,0001533232
BEPC,Brookfield Renewable Corporation Class A Exchangeable Subordinate Voting Shares,stocks,us,XNYS,CS,True,usd,BBG01RJ2V7B2,BBG01RJ2Q8X2,2025-12-02T07:05:58.604127493Z,0001791863
BEPH,Brookfield BRP Holdings (Canada) Inc. 4.625% Perpetual Subordinated Notes,stocks,us,XNYS,SP,True,usd,,,2025-12-02T07:05:58.604127633Z,0001533232
BEPI,Brookfield BRP Holdings (Canada) Inc. 4.875% Perpetual Subordinated Notes,stocks,us,XNYS,SP,True,usd,,,2025-12-02T07:05:58.604127924Z,0001533232
BEPJ,Brookfield BRP Holdings (Canada) Inc. 7.250% Perpetual Subordinated Notes,stocks,us,XNYS,SP,True,usd,,,2025-12-02T07:05:58.604128044Z,0001533232
BEPpA,"Brookfield Renewable Partners L.P. 5.25% Class A Preferred Limited Partnership Units, Series 17",stocks,us,XNYS,PFD,True,usd,,,2025-12-02T07:05:58.604128335Z,0001533232
BERZ,MicroSectors FANG & Innovation -3x Inverse Leveraged ETN,stocks,us,ARCX,ETN,True,usd,BBG0123138B5,BBG012313969,2025-12-02T07:05:58.604128455Z,0000927971
BESF,Bastion Energy ETF,stocks,us,BATS,ETF,True,usd,BBG01V8RP111,BBG01V8RP246,2025-12-02T07:05:58.604128575Z,
BETA,"Beta Technologies, Inc.",stocks,us,XNYS,CS,True,usd,BBG000MBSFT5,BBG001SQ9LQ5,2025-12-02T07:05:58.604129126Z,0001784570
BETE,ProShares Bitcoin & Ether Equal Weight ETF,stocks,us,ARCX,ETF,True,usd,BBG01JLGN2B6,BBG01JLGN351,2025-12-02T07:05:58.604129266Z,
BETH,ProShares Bitcoin & Ether Market Cap Weight ETF,stocks,us,ARCX,ETF,True,usd,BBG01JLGNB44,BBG01JLGNC06,2025-12-02T07:05:58.604129397Z,
BETR,Better Home & Finance Holding Company Class A Common Stock,stocks,us,XNAS,CS,True,usd,BBG0103VG6N0,BBG0103VG6P8,2025-12-02T07:05:58.604129517Z,0001835856
BETRW,Better Home & Finance Holding Company Warrant,stocks,us,XNAS,WARRANT,True,usd,BBG010B6T055,,2025-12-02T07:05:58.604129867Z,0001835856
BETZ,Roundhill Sports Betting & iGaming ETF,stocks,us,ARCX,ETF,True,usd,BBG00V7866V2,BBG00V7867P7,2025-12-02T07:05:58.604129998Z,0001776878
BEX,Tradr 2X Long BE Daily ETF,stocks,us,BATS,ETF,True,usd,BBG01YH4H0Q0,BBG01YH4H1N1,2025-12-02T07:05:58.604130178Z,
BF.A,Brown-Forman Corporation Class A,stocks,us,XNYS,CS,True,usd,BBG000BD2C18,BBG001S5P4G2,2025-12-02T07:05:58.604130298Z,0000014693
BF.B,Brown-Forman Corporation Class B,stocks,us,XNYS,CS,True,usd,BBG000BD2NY8,BBG001S5P4H1,2025-12-02T07:05:58.604130419Z,0000014693
BFAM,BRIGHT HORIZONS FAMILY SOLUTIONS INC.,stocks,us,XNYS,CS,True,usd,BBG003LFWP05,BBG003LFWPT4,2025-12-02T07:05:58.604130649Z,0001437578
BFAP,FT Vest Bitcoin Strategy Floor15 ETF - April,stocks,us,ARCX,ETF,True,usd,BBG01T3YN2T6,BBG01T3YN3R6,2025-12-02T07:05:58.604130779Z,0001329377
BFC,Bank First Corporation Common Stock,stocks,us,XNAS,CS,True,usd,BBG000BG27V9,BBG001S79DP6,2025-12-02T07:05:58.604130919Z,0001746109
BFEB,Innovator U.S. Equity Buffer ETF - February,stocks,us,BATS,ETF,True,usd,BBG00RHZ11C7,BBG00RHZ1235,2025-12-02T07:05:58.60413112Z,0001482688
BFH,"Bread Financial Holdings, Inc.",stocks,us,XNYS,CS,True,usd,BBG000BFNR17,BBG001S78Z50,2025-12-02T07:05:58.60413126Z,0001101215
BFHpA,"Bread Financial Holdings, Inc. Depositary Shares, each representing a 1/40th interest in a share of 8.625% Non-Cumulative Perpetual Preferred Stock, Series A",stocks,us,XNYS,PFD,True,usd,,,2025-12-02T07:05:58.60413138Z,0001101215
BFIN,BankFinancial Corporation,stocks,us,XNAS,CS,True,usd,BBG000BCD4H9,BBG001S69N21,2025-12-02T07:05:58.604131641Z,0001303942
BFIX,Build Bond Innovation ETF,stocks,us,ARCX,ETF,True,usd,BBG01462WN94,BBG01462WP99,2025-12-02T07:05:58.604131761Z,
BFJL,FT Vest Bitcoin Strategy Floor15 ETF - July,stocks,us,ARCX,ETF,True,usd,BBG01VRRV3L7,BBG01VRRV4Y1,2025-12-02T07:05:58.604131911Z,0001125816
BFK,BlackRock Municipal Income Trust,stocks,us,XNYS,FUND,True,usd,BBG000BZGJ91,BBG001SFL2F9,2025-12-02T07:05:58.604132092Z,0001137393
BFLB,BufferLABS US Equity Dynamic Buffer ETF,stocks,us,BATS,ETF,True,usd,BBG01XNY04J7,BBG01XNY0719,2025-12-02T07:05:58.604132402Z,
BFLY,"Butterfly Network, Inc.",stocks,us,XNYS,CS,True,usd,BBG00TN65975,BBG00TN65984,2025-12-02T07:05:58.604132733Z,0001804176
BFLY.WS,"Butterfly Network, Inc. Redeemable Warrants, each whole warrant exercisable for one share of Class A common stock, each at an exercise price of $11.50 per share",stocks,us,XNYS,WARRANT,True,usd,BBG00VXZJCF4,,2025-12-02T07:05:58.604132903Z,0001804176
BFOC,FT Vest Bitcoin Strategy Floor15 ETF - October,stocks,us,ARCX,ETF,True,usd,BBG01XK3K898,BBG01XK3K969,2025-12-02T07:05:58.604133013Z,0001329377
BFOR,Barron's 400 ETF,stocks,us,ARCX,ETF,True,usd,BBG004N1S4Q6,BBG004N1S5G4,2025-12-02T07:05:58.604133134Z,0001414040
BFRE,Westwood LBRTY Global Equity ETF,stocks,us,ARCX,ETF,True,usd,BBG01SX4YJH5,BBG01SX4YKM6,2025-12-02T07:05:58.604133254Z,
BFRG,"Bullfrog AI Holdings, Inc. Common Stock",stocks,us,XNAS,CS,True,usd,BBG01BXY7SH6,BBG01BXY7TD8,2025-12-02T07:05:58.604133374Z,0001829247
BFRGW,"Bullfrog AI Holdings, Inc. Warrants",stocks,us,XNAS,WARRANT,True,usd,BBG01CD99CS2,,2025-12-02T07:05:58.604133484Z,0001829247
BFRI,Biofrontera Inc. Common Stock,stocks,us,XNAS,CS,True,usd,BBG00HTD0PX0,BBG00HTD0PY9,2025-12-02T07:05:58.604133605Z,0001858685
BFRIW,Biofrontera Inc. Warrants,stocks,us,XNAS,WARRANT,True,usd,BBG013841CP0,,2025-12-02T07:05:58.604133735Z,0001858685
BFRZ,Innovator Equity Managed 100 Buffer ETF,stocks,us,ARCX,ETF,True,usd,BBG01TW7DK05,BBG01TW7DKV1,2025-12-02T07:05:58.604133885Z,0001415726
BFS,"Saul Centers, Inc.",stocks,us,XNYS,CS,True,usd,BBG000BJ5G95,BBG001S7F7J9,2025-12-02T07:05:58.604134015Z,0000907254
BFST,"Business First Bancshares, Inc. Common Stock",stocks,us,XNAS,CS,True,usd,BBG000TGZHS6,BBG001T056Q8,2025-12-02T07:05:58.604134126Z,0001624322
BFSpD,"Saul Centers, Inc. Depositary Shares, each representing 1/100th of a share of 6.125% Series D Cumulative Redeemable Preferred Stock",stocks,us,XNYS,PFD,True,usd,,,2025-12-02T07:05:58.604134256Z,0000907254
BFSpE,"Saul Centers, Inc. Depositary Shares, each representing 1/100th of a share of 6.000% Series E Cumulative Redeemable Preferred Stock",stocks,us,XNYS,PFD,True,usd,,,2025-12-02T07:05:58.604134386Z,0000907254
BFZ,BLACKROCK CA MUNICIPAL INC TR,stocks,us,XNYS,FUND,True,usd,BBG000BB9W75,BBG001S5WLM9,2025-12-02T07:05:58.604134496Z,0001137391
BG,Bunge Global SA,stocks,us,XNYS,CS,True,usd,,,2025-12-02T07:05:58.604134616Z,0001996862
BGB,Blackstone Strategic Credit 2027 Term Fund,stocks,us,XNYS,FUND,True,usd,BBG002W5R785,BBG002W5R801,2025-12-02T07:05:58.604134937Z,0001546429
BGC,"BGC Group, Inc. Class A Common Stock",stocks,us,XNAS,CS,True,usd,BBG01H9FTGX5,BBG01H9FTHS9,2025-12-02T07:05:58.604135057Z,0001094831
BGDV,Bahl & Gaynor Dividend ETF,stocks,us,ARCX,ETF,True,usd,BBG01R77QK76,BBG01R77QL56,2025-12-02T07:05:58.604135278Z,
BGH,Barings Global Short Duration High Yield Fund,stocks,us,XNYS,FUND,True,usd,BBG0034WH483,BBG0034WH517,2025-12-02T07:05:58.604135388Z,0001521404
BGI,Birks Group Inc,stocks,us,XASE,CS,True,usd,BBG000BCPBN3,BBG001S6PN78,2025-12-02T07:05:58.604135508Z,0001179821
BGIG,Bahl & Gaynor Income Growth ETF,stocks,us,ARCX,ETF,True,usd,BBG01J9TNBB2,BBG01J9TNC66,2025-12-02T07:05:58.604135628Z,0001539639
BGIN,Bgin Blockchain Limited Class A Ordinary Shares,stocks,us,XNAS,CS,True,usd,,,2025-12-02T07:05:58.604135739Z,0001945565
BGL,Blue Gold Limited Class A Ordinary Shares,stocks,us,XNAS,CS,True,usd,,,2025-12-02T07:05:58.604135869Z,0002019435
BGLC,BioNexus Gene Lab Corp Common stock,stocks,us,XNAS,CS,True,usd,BBG00N70PLY0,BBG00N70PLZ9,2025-12-02T07:05:58.604136049Z,0001737523
BGLD,FT Vest Gold Strategy Quarterly Buffer ETF,stocks,us,BATS,ETF,True,usd,BBG00YXMR9N6,BBG00YXMRBJ6,2025-12-02T07:05:58.60413632Z,0001329377
BGLWW,Blue Gold Limited Warrant,stocks,us,XNAS,WARRANT,True,usd,,,2025-12-02T07:05:58.60413654Z,0002019435
BGM,BGM Group Ltd. Class A Ordinary Shares,stocks,us,XNAS,CS,True,usd,,,2025-12-02T07:05:58.60413667Z,0001779578
BGMS,"Bio Green Med Solution, Inc. Common Stock",stocks,us,XNAS,CS,True,usd,BBG000CT3XM2,BBG001SGNL18,2025-12-02T07:05:58.604136831Z,0001130166
BGMSP,"Bio Green Med Solution, Inc. 6% Convertible Preferred Stock",stocks,us,XNAS,PFD,True,usd,,,2025-12-02T07:05:58.604136961Z,0001130166
BGR,Blackrock Energy and Resources Trust,stocks,us,XNYS,FUND,True,usd,BBG000QD1Q85,BBG001SMMW12,2025-12-02T07:05:58.604137101Z,0001306550
BGRN,iShares Trust iShares USD Green Bond ETF,stocks,us,XNAS,ETF,True,usd,BBG00MK1NPJ5,BBG00MK1NQ85,2025-12-02T07:05:58.604137382Z,0001100663
BGRO,BlackRock ETF Trust iShares Large Cap Growth Active ETF,stocks,us,XNAS,ETF,True,usd,BBG01N4ZX8Z4,BBG01N4ZX9W5,2025-12-02T07:05:58.604137672Z,0001761055
BGS,"B&G Foods, Inc.",stocks,us,XNYS,CS,True,usd,BBG000RKXRQ1,BBG001SQD861,2025-12-02T07:05:58.604137823Z,0001278027
BGSF,"BGSF, Inc.",stocks,us,XNYS,CS,True,usd,BBG005DLS9N2,BBG005DLS9P0,2025-12-02T07:05:58.604138143Z,0001474903
BGSI,Boyd Group Services Inc.,stocks,us,XNYS,CS,True,usd,BBG00RFF38P2,BBG001SFTY52,2025-12-02T07:05:58.604138273Z,0002091467
BGT,BlackRock Floating Rate Income Trust,stocks,us,XNYS,FUND,True,usd,BBG000BWND57,BBG001SCPXR1,2025-12-02T07:05:58.604138414Z,0001287480
BGX,Blackstone Long-Short Credit Income Fund,stocks,us,XNYS,FUND,True,usd,BBG001855699,BBG001TCJG67,2025-12-02T07:05:58.604138544Z,0001504234
BGY,BlackRock Enhanced International Dividend Trust,stocks,us,XNYS,FUND,True,usd,BBG000QY41Y2,BBG001SSV2L3,2025-12-02T07:05:58.604138754Z,0001393299
BH,Biglari Holdings Inc. Class B Common Stock,stocks,us,XNYS,CS,True,usd,BBG00JPRDQH1,BBG00JPRDQJ9,2025-12-02T07:05:58.604138865Z,0001726173
BH.A,Biglari Holdings Inc. Class A Common Stock,stocks,us,XNYS,CS,True,usd,BBG00KK2W379,BBG00KK2W3Y9,2025-12-02T07:05:58.604138985Z,0001726173
BHAT,Blue Hat Interactive Entertainment Technology Ordinary Shares,stocks,us,XNAS,CS,True,usd,,,2025-12-02T07:05:58.604139105Z,0001759136
BHB,Bar Harbor Bankshares,stocks,us,XASE,CS,True,usd,BBG000JKM045,BBG001SB8Q79,2025-12-02T07:05:58.604139215Z,0000743367
BHC,Bausch Health Companies Inc,stocks,us,XNYS,CS,True,usd,BBG000DLFM21,BBG001S7WDP0,2025-12-02T07:05:58.604139335Z,0000885590
BHE,Benchmark Electronics,stocks,us,XNYS,CS,True,usd,BBG000C4JX31,BBG001S6LXL4,2025-12-02T07:05:58.604139456Z,0000863436
BHF,"Brighthouse Financial, Inc.",stocks,us,XNAS,CS,True,usd,BBG00DYPZ4T0,BBG00DYPZ4V7,2025-12-02T07:05:58.604139566Z,0001685040
BHFAL,"Brighthouse Financial, Inc. 6.25% Junior Subordinated Debentures due 2058",stocks,us,XNAS,CS,True,usd,,,2025-12-02T07:05:58.604139686Z,0001685040
BHFAM,"Brighthouse Financial, Inc. Depositary shares each representing a 1/1,000th Interest in a Share of 4.625% Non-Cumulative Preferred Stock, Series D",stocks,us,XNAS,CS,True,usd,,,2025-12-02T07:05:58.604139806Z,0001685040
BHFAN,"Brighthouse Financial, Inc. Depositary shares, each representing a 1/1,000th interest in a share of 5.375% Non-Cumulative Preferred Stock, Series C",stocks,us,XNAS,CS,True,usd,,,2025-12-02T07:05:58.604140147Z,0001685040
BHFAO,"Brighthouse Financial, Inc. Depositary Shares 6.75% Non-Cum Pfd Series B",stocks,us,XNAS,CS,True,usd,,,2025-12-02T07:05:58.604140458Z,0001685040
BHFAP,"Brighthouse Financial, Inc. Depositary Shares 6.6% Non-Cumulative Preferred Stock, Series A",stocks,us,XNAS,PFD,True,usd,,,2025-12-02T07:05:58.604140908Z,0001685040
BHK,BLACKROCK CORE BD TR,stocks,us,XNYS,FUND,True,usd,BBG000C09693,BBG001SFNB21,2025-12-02T07:05:58.604141019Z,0001160864
BHM,"Bluerock Homes Trust, Inc.",stocks,us,XASE,CS,True,usd,BBG0146YWXC8,BBG0146YWXD7,2025-12-02T07:05:58.604141139Z,0001903382
BHP,BHP Group Limited American Depositary Shares (Each representing two Ordinary Shares),stocks,us,XNYS,ADRC,True,usd,BBG000BD5NZ4,BBG001S5P5K4,2025-12-02T07:05:58.604141249Z,0000811809
BHR,Braemar Hotels & Resorts Inc. Common Stock,stocks,us,XNYS,CS,True,usd,BBG004PW84G9,BBG004PW8567,2025-12-02T07:05:58.604141379Z,0001574085
BHRB,Burke & Herbert Financial Services Corp. Common Stock,stocks,us,XNAS,CS,True,usd,BBG019X33P07,BBG019X33P61,2025-12-02T07:05:58.6041415Z,0001964333
BHRpB,Braemar Hotels & Resorts Inc. 5.50% Series B Cumulative Convertible Preferred Stock,stocks,us,XNYS,PFD,True,usd,,,2025-12-02T07:05:58.60414174Z,0001574085
BHRpD,"Braemar Hotels & Resorts Inc. 8.25% Series D Cumulative Preferred Stock, par value $0.01 per share",stocks,us,XNYS,PFD,True,usd,,,2025-12-02T07:05:58.60414186Z,0001574085
BHST,BioHarvest Sciences Inc. Common Stock,stocks,us,XNAS,CS,True,usd,BBG00NB02NZ5,BBG0086KQ0S2,2025-12-02T07:05:58.60414198Z,0001723464
BHV,BlackRock Virginia Muni Bond Trust,stocks,us,XNYS,FUND,True,usd,BBG000DXJJH2,BBG001SKCDT9,2025-12-02T07:05:58.604142231Z,0001169034
BHVN,Biohaven Ltd.,stocks,us,XNYS,CS,True,usd,,,2025-12-02T07:05:58.604142381Z,0001935979
BHYB,Xtrackers USD High Yield BB-B ex Financials ETF,stocks,us,BATS,ETF,True,usd,BBG01JTRL253,BBG01JTRLM68,2025-12-02T07:05:58.604142732Z,
BIAF,"bioAffinity Technologies, Inc. Common Stock",stocks,us,XNAS,CS,True,usd,BBG00H69JDX1,BBG00H69JDY0,2025-12-02T07:05:58.604143193Z,0001712762
BIAFW,"bioAffinity Technologies, Inc. Warrant",stocks,us,XNAS,WARRANT,True,usd,BBG018DZJPN8,,2025-12-02T07:05:58.604143323Z,0001712762
BIB,ProShares Ultra NASDAQ Biotechnology,stocks,us,XNAS,ETF,True,usd,BBG000QMBZX6,BBG001T7V4Q9,2025-12-02T07:05:58.604143724Z,0001174610
BIBL,Inspire 100 ETF,stocks,us,ARCX,ETF,True,usd,BBG00J3H9QW5,BBG00J3H9RL5,2025-12-02T07:05:58.604143974Z,0001733356
BIDD,iShares International Dividend Active ETF,stocks,us,ARCX,ETF,True,usd,BBG01QVVCQY0,BBG01QVVCRV1,2025-12-02T07:05:58.604144165Z,0001761055
BIDU,"Baidu, Inc.",stocks,us,XNAS,ADRC,True,usd,BBG000QXWHD1,BBG001SNBKD5,2025-12-02T07:05:58.604144686Z,0001329099
BIGY,YieldMax Target 12 Big 50 Option Income ETF,stocks,us,ARCX,ETF,True,usd,BBG01QRKG3V9,BBG01QRKG4Q3,2025-12-02T07:05:58.604144806Z,
BIIB,Biogen Inc. Common Stock,stocks,us,XNAS,CS,True,usd,BBG000C17X76,BBG001S67826,2025-12-02T07:05:58.604144926Z,0000875045
BIL,State Street SPDR Bloomberg 1-3 Month T-Bill ETF,stocks,us,ARCX,ETF,True,usd,BBG000RFQSH8,BBG001STKCW9,2025-12-02T07:05:58.604145036Z,0001081019
BILD,Nomura Global Listed Infrastructure ETF,stocks,us,ARCX,ETF,True,usd,BBG01KBR85T1,BBG01KBR86N5,2025-12-02T07:05:58.604145157Z,0001969995
BILI,Bilibili Inc. American Depositary Shares,stocks,us,XNAS,ADRC,True,usd,BBG00K7T3037,BBG00K7T30T9,2025-12-02T07:05:58.604145277Z,0001723690
BILL,"BILL Holdings, Inc.",stocks,us,XNYS,CS,True,usd,BBG00QVJV6V4,BBG00QVJV7L3,2025-12-02T07:05:58.604145397Z,0001786352
BILS,State Street SPDR Bloomberg 3-12 Month T-Bill ETF,stocks,us,ARCX,ETF,True,usd,BBG00X8RXFQ1,BBG00X8RXGK5,2025-12-02T07:05:58.604145517Z,0001081019
BILT,iShares Infrastructure Active ETF,stocks,us,BATS,ETF,True,usd,BBG01W9TSW68,BBG01W9TSX57,2025-12-02T07:05:58.604145647Z,0001761055
BILZ,PIMCO Ultra Short Government Active ETF,stocks,us,ARCX,ETF,True,usd,BBG01GZF4L55,BBG01GZF4M26,2025-12-02T07:05:58.604145878Z,0001450011
BINC,iShares Flexible Income Active ETF,stocks,us,ARCX,ETF,True,usd,BBG01GQYLJ23,BBG01GQYLJY8,2025-12-02T07:05:58.604145998Z,0001804196
BINT,Bluemonte Global Equity ETF,stocks,us,ARCX,ETF,True,usd,BBG01VD0TS93,BBG01VD0TTS0,2025-12-02T07:05:58.604146118Z,0001452937
BINV,Brandes International ETF,stocks,us,BATS,ETF,True,usd,BBG01JM52LJ2,BBG01JM52MM6,2025-12-02T07:05:58.604146299Z,0001616265
BIO,"Bio-Rad Laboratories, Inc.Class A",stocks,us,XNYS,CS,True,usd,BBG000DY28W5,BBG001S625W4,2025-12-02T07:05:58.60414705Z,0000012208
BIO.B,"Bio-Rad Laboratories, Inc. Class B",stocks,us,XNYS,CS,True,usd,BBG000BD6WM7,BBG001S5P622,2025-12-02T07:05:58.604147341Z,0000012208
BIOA,"BioAge Labs, Inc. Common Stock",stocks,us,XNAS,CS,True,usd,BBG00HBTB0M9,BBG00HBTB0N8,2025-12-02T07:05:58.604147591Z,0001709941
BIOX,Bioceres Crop Solutions Corp. Ordinary Shares,stocks,us,XNAS,CS,True,usd,,,2025-12-02T07:05:58.604147721Z,0001769484
BIP,Brookfield Infrastructure Partners L.P. Limited Partnership Units,stocks,us,XNYS,CS,True,usd,,,2025-12-02T07:05:58.604147862Z,0001406234
BIPC,Brookfield Infrastructure Corporation Class A Exchangeable Subordinate Voting Shares,stocks,us,XNYS,CS,True,usd,BBG01RJ2W204,BBG01RJ2TXY3,2025-12-02T07:05:58.604148122Z,0001788348
BIPH,Brookfield Infrastructure Finance ULC 5.000% Subordinated Notes due 2081,stocks,us,XNYS,SP,True,usd,,,2025-12-02T07:05:58.604148373Z,0001406234
BIPI,BIP Bermuda Holdings I Limited 5.125% Perpetual Subordinated Notes,stocks,us,XNYS,SP,True,usd,,,2025-12-02T07:05:58.604148493Z,0001406234
BIPJ,Brookfield Infrastructure Finance ULC 7.250% Subordinated Notes due 2084,stocks,us,XNYS,SP,True,usd,,,2025-12-02T07:05:58.604148673Z,0001406234
BIPpA,"Brookfield Infrastructure Partners L.P. 5.125% Class A Preferred Limited Partnership Units, Series 13",stocks,us,XNYS,PFD,True,usd,,,2025-12-02T07:05:58.604148783Z,0001406234
BIPpB,"Brookfield Infrastructure Partners L.P. 5.000% Class A Preferred Limited Partnership Units, Series 14",stocks,us,XNYS,PFD,True,usd,,,2025-12-02T07:05:58.604148904Z,0001406234
BIRD,"Allbirds, Inc. Class A Common Stock",stocks,us,XNAS,CS,True,usd,BBG00CCNTK76,BBG00CCNTK94,2025-12-02T07:05:58.604149024Z,0001653909
BIRK,Birkenstock Holding plc,stocks,us,XNYS,CS,True,usd,,,2025-12-02T07:05:58.604149134Z,0001977102
BIS,ProShares UltraShort NASDAQ Biotechnology,stocks,us,XNAS,ETF,True,usd,BBG000QMCF87,BBG001T7V4S7,2025-12-02T07:05:58.604149254Z,0001174610
BIT,BLACKROCK MULTI-SECTOR INCOME TRUST,stocks,us,XNYS,FUND,True,usd,BBG003P84BH1,BBG003P84C70,2025-12-02T07:05:58.604149405Z,0001562818
BITB,Bitwise Bitcoin ETF,stocks,us,ARCX,ETV,True,usd,BBG01KY66LW5,BBG01KY66MQ0,2025-12-02T07:05:58.604149545Z,0001763415
BITC,Bitwise Trendwise Bitcoin and Treasuries Rotation Strategy ETF,stocks,us,ARCX,ETF,True,usd,BBG01FZQP5S0,BBG01FZQP6S8,2025-12-02T07:05:58.604150006Z,
BITF,Bitfarms Ltd. Common Stock,stocks,us,XNAS,CS,True,usd,BBG00PZTS4J3,BBG00PGMZVM7,2025-12-02T07:05:58.604150116Z,0001812477
BITI,ProShares Short Bitcoin ETF,stocks,us,ARCX,ETF,True,usd,BBG018C3QG43,BBG018C3QH78,2025-12-02T07:05:58.604150256Z,0001174610
BITK,Tuttle Capital IBIT 0DTE Covered Call ETF,stocks,us,BATS,ETF,True,usd,BBG01XBSGXD8,BBG01XBSGYB8,2025-12-02T07:05:58.604150386Z,
BITO,ProShares Bitcoin ETF,stocks,us,ARCX,ETF,True,usd,BBG0131STJL3,BBG0131STKH5,2025-12-02T07:05:58.604150507Z,0001174610
BITQ,Bitwise Crypto Industry Innovators ETF,stocks,us,ARCX,ETF,True,usd,BBG01Y4FMRX6,BBG01Y4FMSY3,2025-12-02T07:05:58.604150617Z,0001452937
BITS,Global X Blockchain & Bitcoin Strategy ETF,stocks,us,XNAS,ETF,True,usd,BBG013J592N1,BBG013J593K2,2025-12-02T07:05:58.604150737Z,
BITU,ProShares Ultra Bitcoin ETF,stocks,us,ARCX,ETF,True,usd,BBG01M79Z7R0,BBG01M79Z8W2,2025-12-02T07:05:58.604150857Z,
BITX,2x Bitcoin Strategy ETF,stocks,us,BATS,ETF,True,usd,BBG01GXLYLP9,BBG01GXLYNB0,2025-12-02T07:05:58.604150998Z,
BITY,Amplify Bitcoin 2% Monthly Option Income ETF,stocks,us,BATS,ETF,True,usd,BBG01THXH1S3,BBG01THXH2N6,2025-12-02T07:05:58.604151118Z,0001633061
BIV,Vanguard Intermediate-Term Bond ETF,stocks,us,ARCX,ETF,True,usd,BBG000R44SW0,BBG001ST39R1,2025-12-02T07:05:58.604151248Z,0000794105
BIVI,"BioVie, Inc. Common Stock",stocks,us,XNAS,CS,True,usd,BBG00548BTD6,BBG00548BTF4,2025-12-02T07:05:58.604151358Z,0001580149
BIVIW,BioVie Inc. Warrant,stocks,us,XNAS,WARRANT,True,usd,BBG01WJZNKD6,,2025-12-02T07:05:58.604151479Z,0001580149
BIYA,Baiya International Group Inc. Ordinary Shares,stocks,us,XNAS,CS,True,usd,,,2025-12-02T07:05:58.604151599Z,0001944712
BIZD,VanEck BDC Income ETF,stocks,us,ARCX,ETF,True,usd,BBG00440GKJ4,BBG00440GL84,2025-12-02T07:05:58.604151719Z,0001137360
BJ,"BJs Wholesale Club Holdings, Inc. Common Stock",stocks,us,XNYS,CS,True,usd,BBG00FQ8T4G3,BBG00FQ8T4M6,2025-12-02T07:05:58.604151839Z,0001531152
BJAN,Innovator U.S. Equity Buffer ETF - January,stocks,us,BATS,ETF,True,usd,BBG00MYXK749,BBG00MYXK7W8,2025-12-02T07:05:58.60415244Z,0001482688
BJDX,"Bluejay Diagnostics, Inc. Common Stock",stocks,us,XNAS,CS,True,usd,BBG012TKJCJ1,BBG012TKJDC6,2025-12-02T07:05:58.604152621Z,0001704287
BJK,VanEck Gaming ETF,stocks,us,XNAS,ETF,True,usd,BBG000V86Z03,BBG001T1Q9C2,2025-12-02T07:05:58.604152921Z,0001137360
BJRI,"BJ's Restaurants, Inc.",stocks,us,XNAS,CS,True,usd,BBG000H9LNX1,BBG001S970P2,2025-12-02T07:05:58.604153102Z,0001013488
BJUL,Innovator U.S. Equity Buffer ETF - July,stocks,us,BATS,ETF,True,usd,BBG00LNJLC51,BBG00LNJLCX0,2025-12-02T07:05:58.604153232Z,0001482688
BJUN,Innovator U.S. Equity Buffer ETF - June,stocks,us,BATS,ETF,True,usd,BBG00PBD5ZW5,BBG00PBD60M2,2025-12-02T07:05:58.604153352Z,0001415726
BK,Bank of New York Mellon Corporation,stocks,us,XNYS,CS,True,usd,BBG000BD8PN9,BBG001S5P6Q6,2025-12-02T07:05:58.604153462Z,0001390777
BKAG,BNY Mellon Core Bond ETF,stocks,us,ARCX,ETF,True,usd,BBG00RYR56Q6,BBG00RYR57H4,2025-12-02T07:05:58.604153593Z,
BKCG,BNY Mellon Concentrated Growth ETF,stocks,us,ARCX,ETF,True,usd,BBG01SXJKVN3,BBG01SXJKWT5,2025-12-02T07:05:58.604153713Z,
BKCH,Global X Blockchain ETF,stocks,us,XNAS,ETF,True,usd,BBG011RVGZP6,BBG011RVH0K7,2025-12-02T07:05:58.604153923Z,0001432353
BKCI,BNY Mellon Concentrated International ETF,stocks,us,ARCX,ETF,True,usd,BBG013VPCK31,BBG013VPCL11,2025-12-02T07:05:58.604154033Z,
BKD,"Brookdale Senior Living, Inc.",stocks,us,XNYS,CS,True,usd,BBG000J4L211,BBG001SDHC58,2025-12-02T07:05:58.604154384Z,0001332349
BKDV,BNY Mellon Dynamic Value ETF,stocks,us,ARCX,ETF,True,usd,BBG01QM8ZCH6,BBG01QM8ZDG5,2025-12-02T07:05:58.604154504Z,
BKE,"The Buckle, Inc.",stocks,us,XNYS,CS,True,usd,BBG000BD9525,BBG001S5P6T3,2025-12-02T07:05:58.604154625Z,0000885245
BKEM,BNY Mellon Emerging Markets Equity ETF,stocks,us,ARCX,ETF,True,usd,BBG00RYRC6L3,BBG00RYRC7B2,2025-12-02T07:05:58.604154745Z,
BKF,iShares MSCI BIC ETF,stocks,us,ARCX,ETF,True,usd,BBG000TVZ652,BBG001T0LKN2,2025-12-02T07:05:58.604155105Z,0000930667
BKGI,BNY Mellon Global Infrastructure Income ETF,stocks,us,BATS,ETF,True,usd,BBG01B7B20H1,BBG01B7B21C4,2025-12-02T07:05:58.604155236Z,
BKH,Black Hills Corporation,stocks,us,XNYS,CS,True,usd,BBG000BD9ZM7,BBG001S5P6X8,2025-12-02T07:05:58.604155356Z,0001130464
BKHA,Black Hawk Acquisition Corporation Class A Ordinary Shares,stocks,us,XNAS,CS,True,usd,,,2025-12-02T07:05:58.604155486Z,0002000775
BKHAR,Black Hawk Acquisition Corporation Rights,stocks,us,XNAS,RIGHT,True,usd,,,2025-12-02T07:05:58.604155747Z,0002000775
BKHAU,Black Hawk Acquisition Corporation Units,stocks,us,XNAS,UNIT,True,usd,,,2025-12-02T07:05:58.604156017Z,0002000775
BKHY,BNY Mellon High Yield ETF,stocks,us,ARCX,ETF,True,usd,BBG00RYR5TG7,BBG00RYR5V63,2025-12-02T07:05:58.604156218Z,
BKIE,BNY Mellon International Equity ETF,stocks,us,ARCX,ETF,True,usd,BBG00RYRB9H3,BBG00RYRBB79,2025-12-02T07:05:58.604156338Z,
BKKT,"Bakkt Holdings, Inc.",stocks,us,XNYS,CS,True,usd,BBG00XRJ7Y40,BBG00XRJ7Y59,2025-12-02T07:05:58.604156458Z,0001820302
BKKT.WS,"Bakkt Holdings, Inc Warrants to purchase Class A Common Stock Each Warrant entitles to purchase 1/25th of a share of Class A common stock at an exercise price of $287.50 for one share of Class A Common Stock",stocks,us,XNYS,WARRANT,True,usd,BBG00Y624BK3,,2025-12-02T07:05:58.604156618Z,0001820302
