ticker,name,market,locale,primary_exchange,type,active,currency_name,composite_figi,share_class_figi,last_updated_utc,cik
A,Agilent Technologies Inc.,stocks,us,XNYS,CS,True,usd,BBG000C2V3D6,BBG001SCTQY4,2025-12-02T07:05:58.6039315Z,0001090872
AA,Alcoa Corporation,stocks,us,XNYS,CS,True,usd,BBG00B3T3HD3,BBG00B3T3HF1,2025-12-02T07:05:58.603933294Z,0001675149
AAA,Alternative Access First Priority CLO Bond ETF,stocks,us,ARCX,ETF,True,usd,BBG01B0JRCS6,BBG01B0JRCT5,2025-12-02T07:05:58.603933404Z,0001776878
AAAA,Amplius Aggressive Asset Allocation ETF,stocks,us,BATS,ETF,True,usd,BBG01W275XX6,BBG01W275ZB5,2025-12-02T07:05:58.603933674Z,
AAAU,Goldman Sachs Physical Gold ETF Shares,stocks,us,BATS,ETF,True,usd,BBG00LPXX872,BBG00LPXX8Z1,2025-12-02T07:05:58.603933805Z,0001708646
AACB,Artius II Acquisition Inc. Class A Ordinary Shares,stocks,us,XNAS,CS,True,usd,,,2025-12-02T07:05:58.603933915Z,0002034334
AACBR,Artius II Acquisition Inc. Rights,stocks,us,XNAS,RIGHT,True,usd,,,2025-12-02T07:05:58.603934035Z,0002034334
AACBU,Artius II Acquisition Inc. Units,stocks,us,XNAS,UNIT,True,usd,,,2025-12-02T07:05:58.603934165Z,0002034334
AACG,ATA Creativity Global American Depositary Shares,stocks,us,XNAS,ADRC,True,usd,BBG000V2S3P6,BBG001T125S9,2025-12-02T07:05:58.603934626Z,0001420529
AADR,AdvisorShares Dorsey Wright ADR ETF,stocks,us,XNAS,ETF,True,usd,BBG000BDYRW6,BBG001T9B1Y4,2025-12-02T07:05:58.603934746Z,0001408970
AAL,American Airlines Group Inc.,stocks,us,XNAS,CS,True,usd,BBG005P7Q881,BBG005P7Q907,2025-12-02T07:05:58.603934877Z,0000006201
AALG,Leverage Shares 2X Long AAL Daily ETF,stocks,us,XNAS,ETF,True,usd,BBG01VH49P35,BBG01VH49Q06,2025-12-02T07:05:58.603934987Z,0001976322
AAM,AA Mission Acquisition Corp.,stocks,us,XNYS,CS,True,usd,,,2025-12-02T07:05:58.603935107Z,0002012964
AAM.U,"AA Mission Acquisition Corp. Units, each consisting of one Class A Ordinary Share and one-half of one redeemable warrant",stocks,us,XNYS,UNIT,True,usd,,,2025-12-02T07:05:58.603935227Z,0002012964
AAM.WS,"AA Mission Acquisition Corp. Warrants, each whole warrant entitles the holder to purchase one Class A ordinary share at a price of $11.50 per share",stocks,us,XNYS,WARRANT,True,usd,,,2025-12-02T07:05:58.603936339Z,0002012964
AAME,Atlantic American Corp,stocks,us,XNAS,CS,True,usd,BBG000B9XB24,BBG001S5N8T1,2025-12-02T07:05:58.60393646Z,0000008177
AAMI,Acadian Asset Management Inc.,stocks,us,XNYS,CS,True,usd,BBG00P2HLNY3,BBG00P2HLNZ2,2025-12-02T07:05:58.60393681Z,0001748824
AAOI,"Applied Optoelectronics, Inc.",stocks,us,XNAS,CS,True,usd,BBG000D6VW15,BBG001SG47G4,2025-12-02T07:05:58.60393693Z,0001158114
AAON,Aaon Inc,stocks,us,XNAS,CS,True,usd,BBG000C2LZP3,BBG001S6CZK0,2025-12-02T07:05:58.603937051Z,0000824142
AAP,ADVANCE AUTO PARTS INC,stocks,us,XNYS,CS,True,usd,BBG000F7RCJ1,BBG001SD2SB2,2025-12-02T07:05:58.603937171Z,0001158449
AAPB,GraniteShares ETF Trust GraniteShares 2x Long AAPL Daily ETF,stocks,us,XNAS,ETF,True,usd,BBG0193F21N2,BBG0193F22H7,2025-12-02T07:05:58.603937291Z,0001689873
AAPD,Direxion Daily AAPL Bear 1X Shares,stocks,us,XNAS,ETF,True,usd,BBG0193YGJ57,BBG0193YGK09,2025-12-02T07:05:58.603937411Z,
AAPG,Ascentage Pharma Group International American Depository Shares,stocks,us,XNAS,ADRC,True,usd,BBG01RJXM9C9,BBG01RJXMB89,2025-12-02T07:05:58.603937722Z,0002023311
AAPL,Apple Inc.,stocks,us,XNAS,CS,True,usd,BBG000B9XRY4,BBG001S5N8V8,2025-12-02T07:05:58.603937842Z,0000320193
AAPR,Innovator Equity Defined Protection ETF - 2 Yr to April 2026,stocks,us,BATS,ETF,True,usd,BBG01M698CQ1,BBG01M698DK5,2025-12-02T07:05:58.603938063Z,0001415726
AAPU,Direxion Shares ETF Trust Direxion Daily AAPL Bull 2X Shares,stocks,us,XNAS,ETF,True,usd,BBG0193YBZ92,BBG0193YC043,2025-12-02T07:05:58.603938193Z,
AAPW,Roundhill AAPL WeeklyPay ETF,stocks,us,BATS,ETF,True,usd,BBG01SCFVRC3,BBG01SCFVS86,2025-12-02T07:05:58.603938303Z,
AAPX,T-Rex 2X Long Apple Daily Target ETF,stocks,us,BATS,ETF,True,usd,BBG01KY72SD3,BBG01KY72T78,2025-12-02T07:05:58.603938493Z,
AAPY,Kurv Yield Premium Strategy Apple (AAPL) ETF,stocks,us,BATS,ETF,True,usd,BBG01QY0GMH9,BBG01QY0GNH7,2025-12-02T07:05:58.603938614Z,0001848758
AARD,"Aardvark Therapeutics, Inc. Common Stock",stocks,us,XNAS,CS,True,usd,BBG01223DLB2,BBG01223DLC1,2025-12-02T07:05:58.603938734Z,0001774857
AAT,"AMERICAN ASSETS TRUST, INC.",stocks,us,XNYS,CS,True,usd,BBG00161BCR0,BBG001TCBJS5,2025-12-02T07:05:58.603939245Z,0001500217
AAUC,Allied Gold Corporation,stocks,us,XNYS,CS,True,usd,BBG01K0WWT59,BBG01J3PPZ58,2025-12-02T07:05:58.603939375Z,0001993344
AAUM,Tema Alternative Asset Managers ETF,stocks,us,BATS,ETF,True,usd,BBG01X2NVVB8,BBG01X2NVW80,2025-12-02T07:05:58.603939505Z,0002056807
AAUS,Alpha Architect US Equity ETF,stocks,us,XNAS,ETF,True,usd,BBG01W26H9C1,BBG01W26HBL6,2025-12-02T07:05:58.603939616Z,
AAVM,EA Series Trust Alpha Architect Global Factor Equity ETF,stocks,us,XNAS,ETF,True,usd,BBG00GM1DQV1,BBG00GM1DRK1,2025-12-02T07:05:58.603939736Z,
AAXJ,iShares MSCI All Country Asia ex Japan ETF,stocks,us,XNAS,ETF,True,usd,BBG000G6GXC5,BBG001T2V2D8,2025-12-02T07:05:58.603939856Z,0001100663
AB,"AllianceBernstein Holding, L.P.",stocks,us,XNYS,CS,True,usd,BBG000B9WM03,BBG001S5N9S0,2025-12-02T07:05:58.603939976Z,0000825313
ABAT,American Battery Technology Company Common Stock,stocks,us,XNAS,CS,True,usd,BBG004M1KJN5,BBG004M1KJP3,2025-12-02T07:05:58.603940097Z,0001576873
ABBV,ABBVIE INC.,stocks,us,XNYS,CS,True,usd,BBG0025Y4RY4,BBG0025Y4RZ3,2025-12-02T07:05:58.603940207Z,0001551152
ABCB,Ameris Bancorp,stocks,us,XNYS,CS,True,usd,BBG000CDY3H5,BBG001S80PX7,2025-12-02T07:05:58.603940337Z,0000351569
ABCL,AbCellera Biologics Inc. Common Shares,stocks,us,XNAS,CS,True,usd,BBG00LLW2MF2,BBG00LLW2MH0,2025-12-02T07:05:58.603940457Z,0001703057
ABCS,Alpha Blue Capital US Small-Mid Cap Dynamic ETF,stocks,us,XNAS,ETF,True,usd,BBG01KMFQRF2,BBG01KMFQS88,2025-12-02T07:05:58.603940567Z,
ABEO,Abeona Therapeutics Inc. Common Stock,stocks,us,XNAS,CS,True,usd,BBG000DT5D52,BBG001S8T7K0,2025-12-02T07:05:58.603940688Z,0000318306
ABEQ,Absolute Select Value ETF,stocks,us,ARCX,ETF,True,usd,BBG00RHHGQY2,BBG00RHHGRP0,2025-12-02T07:05:58.603940818Z,0001199046
ABEV,AMBEV S.A.,stocks,us,XNYS,ADRC,True,usd,BBG000BN5VZ4,BBG005KLVT74,2025-12-02T07:05:58.603940928Z,0001565025
ABFL,Abacus FCF Leaders ETF,stocks,us,BATS,ETF,True,usd,BBG00DW3P010,BBG00DW3P029,2025-12-02T07:05:58.603941058Z,
ABG,"Asbury Automotive Group, Inc.",stocks,us,XNYS,CS,True,usd,BBG000BKDWB5,BBG001S9B5H5,2025-12-02T07:05:58.603941519Z,0001144980
ABI,VictoryShares Pioneer Asset-Based Income ETF,stocks,us,XNAS,ETF,True,usd,BBG01VCKWDB6,BBG01VCKWFN8,2025-12-02T07:05:58.60394177Z,
ABIG,Argent Large Cap ETF,stocks,us,XNAS,ETF,True,usd,BBG01TCJ3701,BBG01TCJ37Z3,2025-12-02T07:05:58.60394189Z,
ABL,"Abacus Global Management, Inc. Class A Common Stock",stocks,us,XNAS,CS,True,usd,BBG00VY1KB95,BBG00VY1KBC1,2025-12-02T07:05:58.60394201Z,0001814287
ABLD,Abacus FCF Real Assets Leaders ETF,stocks,us,BATS,ETF,True,usd,BBG0141PBK24,BBG0141PBL04,2025-12-02T07:05:58.60394212Z,
ABLG,Abacus FCF International Leaders ETF,stocks,us,BATS,ETF,True,usd,BBG00H1J5D96,BBG00H1J5FN5,2025-12-02T07:05:58.603942241Z,
ABLLL,"Abacus Global Management, Inc. 9.875% Fixed Rate Senior Notes due 2028",stocks,us,XNAS,CS,True,usd,,,2025-12-02T07:05:58.603942351Z,0001814287
ABLS,Abacus FCF Small Cap Leaders ETF,stocks,us,BATS,ETF,True,usd,BBG01SCGBTV8,BBG01SCGBVT6,2025-12-02T07:05:58.603942471Z,
ABLV,Able View Global Inc. Class B Ordinary Shares,stocks,us,XNAS,CS,True,usd,,,2025-12-02T07:05:58.603942711Z,0001957489
ABLVW,Able View Global Inc. Warrant,stocks,us,XNAS,WARRANT,True,usd,,,2025-12-02T07:05:58.603942852Z,0001957489
ABM,"ABM Industries, Inc.",stocks,us,XNYS,CS,True,usd,BBG000B9YYH7,BBG001S5N9B8,2025-12-02T07:05:58.603942972Z,0000771497
ABNB,"Airbnb, Inc. Class A Common Stock",stocks,us,XNAS,CS,True,usd,BBG001Y2XS07,BBG001Y2XS16,2025-12-02T07:05:58.603943142Z,0001559720
ABNG,Leverage Shares 2x Long ABNB Daily ETF,stocks,us,XNAS,ETF,True,usd,BBG01YJKQMJ2,BBG01YJKQP87,2025-12-02T07:05:58.603943263Z,0001976322
ABNY,YieldMax ABNB Option Income Strategy ETF,stocks,us,ARCX,ETS,True,usd,BBG01JHFMD75,BBG01JHFMF34,2025-12-02T07:05:58.603943373Z,
ABOS,"Acumen Pharmaceuticals, Inc. Common Stock",stocks,us,XNAS,CS,True,usd,BBG0058YJ317,BBG0058YJ326,2025-12-02T07:05:58.603943523Z,0001576885
ABOT,Abacus FCF Innovation Leaders ETF,stocks,us,BATS,ETF,True,usd,BBG00YC69CJ2,BBG00YC69DC7,2025-12-02T07:05:58.603943653Z,
ABP,"Abpro Holdings, Inc Common Stock",stocks,us,XNAS,CS,True,usd,BBG013X0S7F3,BBG013X0S889,2025-12-02T07:05:58.603944014Z,0001893219
ABPWW,"Abpro Holdings, Inc. Warrant",stocks,us,XNAS,WARRANT,True,usd,BBG0142NHSW2,,2025-12-02T07:05:58.603944134Z,
ABR,"Arbor Realty Trust, Inc.",stocks,us,XNYS,CS,True,usd,BBG000KMVDV1,BBG001SJP3G4,2025-12-02T07:05:58.603944455Z,0001253986
ABRpD,"Arbor Realty Trust, Inc. 6.375% Series D Cumulative Redeemable Preferred Stock, Liquidation Preference $25.00 per Share",stocks,us,XNYS,PFD,True,usd,,,2025-12-02T07:05:58.603944575Z,0001253986
ABRpE,"Arbor Realty Trust, Inc. 6.25% Series E Cumulative Redeemable Preferred Stock",stocks,us,XNYS,PFD,True,usd,,,2025-12-02T07:05:58.603944695Z,0001253986
ABRpF,"Arbor Realty Trust, Inc. 6.25% Series F Fixed-to-Floating Rate Cumulative Redeemable Preferred Stock, Liquidation Preference $25.00 per share",stocks,us,XNYS,PFD,True,usd,,,2025-12-02T07:05:58.603944815Z,0001253986
ABSI,Absci Corporation Common Stock,stocks,us,XNAS,CS,True,usd,BBG011N54CJ8,BBG011N54DC3,2025-12-02T07:05:58.603944936Z,0001672688
ABT,Abbott Laboratories,stocks,us,XNYS,CS,True,usd,BBG000B9ZXB4,BBG001S5N9M6,2025-12-02T07:05:58.603945056Z,0000001800
ABTC,American Bitcoin Corp. Class A Common Stock,stocks,us,XNAS,CS,True,usd,BBG00MS8GZP1,BBG00MS8GZQ0,2025-12-02T07:05:58.603945176Z,0001755953
ABTS,Abits Group Inc Ordinary Shares,stocks,us,XNAS,CS,True,usd,,,2025-12-02T07:05:58.603945316Z,0001864055
ABUS,Arbutus Biopharma Corporation Common Stock,stocks,us,XNAS,CS,True,usd,BBG000RR8V85,BBG001S6RSK0,2025-12-02T07:05:58.603945427Z,0001447028
ABVC,"ABVC BioPharma, Inc. Common Stock",stocks,us,XNAS,CS,True,usd,BBG000Q844Z2,BBG001SMCS49,2025-12-02T07:05:58.603945547Z,0001173313
ABVE,Above Food Ingredients Inc. Common Stock,stocks,us,XNAS,CS,True,usd,BBG01NGG37N1,BBG01NGG37P9,2025-12-02T07:05:58.603945657Z,0001979484
ABVEW,Above Food Ingredients Inc. Warrants,stocks,us,XNAS,WARRANT,True,usd,BBG01NKYQFV5,,2025-12-02T07:05:58.603945777Z,0001979484
ABVX,Abivax SA American Depositary Shares,stocks,us,XNAS,ADRC,True,usd,BBG01JLQNZ03,BBG01JLQNZV9,2025-12-02T07:05:58.603945888Z,0001956827
ABXB,Abacus Flexible Bond Leaders ETF,stocks,us,BATS,ETF,True,usd,BBG00YC5ZT62,BBG00YC5ZV49,2025-12-02T07:05:58.603946008Z,
ACA,"Arcosa, Inc. Common Stock",stocks,us,XNYS,CS,True,usd,BBG00JGMWFM9,BBG00JGMWGB9,2025-12-02T07:05:58.603946499Z,0001739445
ACAD,Acadia Pharmaceuticals Inc.,stocks,us,XNAS,CS,True,usd,BBG000BHG9K0,BBG001SB06N3,2025-12-02T07:05:58.603946609Z,0001070494
ACB,Aurora Cannabis Inc. Common Shares,stocks,us,XNAS,CS,True,usd,BBG006SCSYG7,BBG001SV77D1,2025-12-02T07:05:58.603946799Z,0001683541
ACCL,Acco Group Holdings Limited Ordinary Shares,stocks,us,XNAS,CS,True,usd,,,2025-12-02T07:05:58.60394711Z,0002038378
ACCO,Acco Brands Corporation,stocks,us,XNYS,CS,True,usd,BBG000J06K07,BBG001SPBTK3,2025-12-02T07:05:58.60394723Z,0000712034
ACCS,ACCESS Newswire Inc.,stocks,us,XASE,CS,True,usd,BBG000C1CK87,BBG001S67C09,2025-12-02T07:05:58.60394744Z,0000843006
ACDC,ProFrac Holding Corp. Class A Common Stock,stocks,us,XNAS,CS,True,usd,BBG013PRYPJ2,BBG013PRYQC7,2025-12-02T07:05:58.603947551Z,0001881487
ACEI,Innovator Equity Autocallable Income Strategy ETF,stocks,us,ARCX,ETF,True,usd,BBG01XK51Q67,BBG01XK51R47,2025-12-02T07:05:58.603947671Z,0001415726
ACEL,"Accel Entertainment, Inc.",stocks,us,XNYS,CS,True,usd,BBG00GX221W3,BBG00GX221Z0,2025-12-02T07:05:58.603947941Z,0001698991
ACEP,ARS Core Equity Portfolio ETF,stocks,us,XNAS,ETF,True,usd,BBG01YLHMRZ1,BBG01YLHMSY0,2025-12-02T07:05:58.603948072Z,
ACES,ALPS Clean Energy ETF,stocks,us,ARCX,ETF,True,usd,BBG00L99FCT0,BBG00L99FDK7,2025-12-02T07:05:58.603948202Z,0001414040
ACET,"Adicet Bio, Inc. Common Stock",stocks,us,XNAS,CS,True,usd,BBG00JCXSJP3,BBG00JCXSJQ2,2025-12-02T07:05:58.603948322Z,0001720580
ACFN,"Acorn Energy, Inc. Common Stock",stocks,us,XNAS,CS,True,usd,BBG000CMY866,BBG001S6ZZ25,2025-12-02T07:05:58.603948452Z,0000880984
ACGL,Arch Capital Group Ltd,stocks,us,XNAS,CS,True,usd,,,2025-12-02T07:05:58.603948563Z,0000947484
ACGLN,"Arch Capital Group Ltd. Depositary Shares, each Representing a 1/1,000th Interest in a 4.550% Non-Cumulative Preferred Share, Series G",stocks,us,XNAS,CS,True,usd,,,2025-12-02T07:05:58.603948693Z,0000947484
ACGLO,"Arch Capital Group Ltd. Depositary Shares Each Representing 1/1,000th Interest in a Share of 5.45% Non-Cumulative Preferred Shares, Series F",stocks,us,XNAS,PFD,True,usd,,,2025-12-02T07:05:58.603948833Z,0000947484
ACGR,American Century Large Cap Growth ETF,stocks,us,ARCX,ETF,True,usd,BBG011MFL031,BBG011MFL0Y7,2025-12-02T07:05:58.603949484Z,0001481714
ACHC,"Acadia Healthcare Company, Inc.",stocks,us,XNAS,CS,True,usd,BBG000FPNN38,BBG001SNNWL7,2025-12-02T07:05:58.603949605Z,0001520697
ACHR,Archer Aviation Inc.,stocks,us,XNYS,CS,True,usd,BBG00XRTC910,BBG00XRTC929,2025-12-02T07:05:58.603949985Z,0001824502
ACHR.WS,"Archer Aviation Inc. Redeemable Warrants, each whole warrant exercisable for one Class A common stock at an exercise price of $11.50",stocks,us,XNYS,WARRANT,True,usd,BBG00YGCV1N9,,2025-12-02T07:05:58.603950116Z,0001824502
ACHV,"Achieve Life Sciences, Inc.",stocks,us,XNAS,CS,True,usd,BBG000FB8S62,BBG001S8JF14,2025-12-02T07:05:58.603950236Z,0000949858
ACI,"Albertsons Companies, Inc.",stocks,us,XNYS,CS,True,usd,BBG009KG1750,BBG009KG1741,2025-12-02T07:05:58.603950366Z,0001646972
ACIC,American Coastal Insurance Corporation Common Stock,stocks,us,XNAS,CS,True,usd,BBG000TKFJQ7,BBG001T09W05,2025-12-02T07:05:58.603950536Z,0001401521
ACII,Innovator Index Autocallable Income Strategy ETF,stocks,us,ARCX,ETF,True,usd,BBG01XK52JX2,BBG01XK52KW0,2025-12-02T07:05:58.603950667Z,0001838614
ACIO,Aptus Collared Investment Opportunity ETF,stocks,us,BATS,ETF,True,usd,BBG00PNSDFF3,BBG00PNSDG52,2025-12-02T07:05:58.603951138Z,0001539639
ACIU,AC Immune SA,stocks,us,XNAS,CS,True,usd,,,2025-12-02T07:05:58.603951258Z,0001651625
ACIW,"ACI Worldwide, Inc.",stocks,us,XNAS,CS,True,usd,BBG000PMBV39,BBG001S9KLL5,2025-12-02T07:05:58.603951378Z,0000935036
ACKY,VistaShares Target 15 ACKtivist Distribution ETF,stocks,us,ARCX,ETF,True,usd,BBG01WHYZLL7,BBG01WHYZMG1,2025-12-02T07:05:58.603951498Z,0001722388
ACLC,American Century Large Cap Equity ETF,stocks,us,ARCX,ETF,True,usd,BBG00W0JV9Q5,BBG00W0JVBH0,2025-12-02T07:05:58.603951608Z,0001481714
ACLO,TCW AAA CLO ETF,stocks,us,XNYS,ETF,True,usd,BBG01QPVFLN7,BBG01QPVFMJ0,2025-12-02T07:05:58.603951729Z,0001831313
ACLS,Axcelis Technologies Inc,stocks,us,XNAS,CS,True,usd,BBG000DW34S2,BBG001SF8W86,2025-12-02T07:05:58.603951849Z,0001113232
ACLX,"Arcellx, Inc. Common Stock",stocks,us,XNAS,CS,True,usd,BBG00QHJM4S9,BBG00QHJM4W4,2025-12-02T07:05:58.603951969Z,0001786205
ACM,Aecom,stocks,us,XNYS,CS,True,usd,BBG000F61RJ8,BBG001SKTTF1,2025-12-02T07:05:58.60395244Z,0000868857
ACMR,"ACM Research, Inc. Class A Common Stock",stocks,us,XNAS,CS,True,usd,BBG00HPSG933,BBG00HPSG942,2025-12-02T07:05:58.60395256Z,0001680062
ACN,Accenture PLC,stocks,us,XNYS,CS,True,usd,,,2025-12-02T07:05:58.603952751Z,0001467373
ACNB,ACNB Corp,stocks,us,XNAS,CS,True,usd,BBG000BJ2LY9,BBG001S6CVZ3,2025-12-02T07:05:58.603952871Z,0000715579
ACNT,Ascent Industries Co. Common Stock,stocks,us,XNAS,CS,True,usd,BBG000CLRHW7,BBG001S6Z1R3,2025-12-02T07:05:58.603952991Z,0000095953
ACOG,Alpha Cognition Inc. Common Stock,stocks,us,XNAS,CS,True,usd,BBG011CJPRD0,BBG00L7TXNM1,2025-12-02T07:05:58.603953111Z,0001655923
ACON,"Aclarion, Inc. Common Stock",stocks,us,XNAS,CS,True,usd,BBG014FBN4K3,BBG014FBN5N7,2025-12-02T07:05:58.603953242Z,0001635077
ACONW,"Aclarion, Inc. Warrant",stocks,us,XNAS,WARRANT,True,usd,BBG016Z2HS66,,2025-12-02T07:05:58.603953392Z,0001635077
ACP,abrdn Income Credit Strategies Fund,stocks,us,XNYS,FUND,True,usd,BBG0017VSC04,BBG001TCSLH4,2025-12-02T07:05:58.603953592Z,0001503290
ACPpA,abrdn Income Credit Strategies Fund  5.250% Series A Perpetual Preferred Stock,stocks,us,XNYS,PFD,True,usd,,,2025-12-02T07:05:58.603953712Z,0001503290
ACR,ACRES Commercial Realty Corp.,stocks,us,XNYS,CS,True,usd,BBG000HK4RX6,BBG001SP6Y91,2025-12-02T07:05:58.603953833Z,0001332551
ACRE,Ares Commercial Real Estate Corporation,stocks,us,XNYS,CS,True,usd,BBG0022MMQB0,BBG0022MMR46,2025-12-02T07:05:58.603953963Z,0001529377
ACRS,"Aclaris Therapeutics, Inc.",stocks,us,XNAS,CS,True,usd,BBG003LF0QR9,BBG003LF0QS8,2025-12-02T07:05:58.603954324Z,0001557746
ACRV,"Acrivon Therapeutics, Inc. Common Stock",stocks,us,XNAS,CS,True,usd,BBG011RWR2Q4,BBG011RWR2R3,2025-12-02T07:05:58.603954444Z,0001781174
ACRpC,"ACRES Commercial Realty Corp. 8.625% Fixed-to-Floating Series C Cumulative Redeemable Preferred Stock, par value $0.001 per share",stocks,us,XNYS,PFD,True,usd,,,2025-12-02T07:05:58.603954985Z,0001332551
ACRpD,ACRES Commercial Realty Corp. 7.875% Series D Cumulative Redeemable Preferred Stock,stocks,us,XNYS,PFD,True,usd,,,2025-12-02T07:05:58.603955105Z,0001332551
ACSG,American Century Small Cap Growth Insights ETF,stocks,us,BATS,ETF,True,usd,BBG01XQ53YJ8,BBG01XQ53ZM1,2025-12-02T07:05:58.603955295Z,
ACSI,American Customer Satisfaction ETF,stocks,us,BATS,ETF,True,usd,BBG00F40VFY6,BBG00F40VGP4,2025-12-02T07:05:58.603955406Z,0001387131
ACSV,American Century Small Cap Value Insights ETF,stocks,us,BATS,ETF,True,usd,BBG01XQ5CXM6,BBG01XQ5D083,2025-12-02T07:05:58.603955536Z,
ACT,"Enact Holdings, Inc. Common Stock",stocks,us,XNAS,CS,True,usd,BBG00WSNP4R3,BBG00WSNP4S2,2025-12-02T07:05:58.603955646Z,0001823529
ACTG,Acacia Research Corporation,stocks,us,XNAS,CS,True,usd,BBG000KF9J02,BBG001SJLJT9,2025-12-02T07:05:58.603955766Z,0000934549
ACTU,"Actuate Therapeutics, Inc. Common stock",stocks,us,XNAS,CS,True,usd,BBG00NK7LK03,BBG00NK7LK12,2025-12-02T07:05:58.603955887Z,0001652935
ACU,Acme United Corporation,stocks,us,XASE,CS,True,usd,BBG000BB3LM8,BBG001S5NCC0,2025-12-02T07:05:58.603955997Z,0000002098
ACV,Virtus Diversified Income & Convertible Fund,stocks,us,XNYS,FUND,True,usd,BBG008HMBD22,BBG008HMBD31,2025-12-02T07:05:58.603956117Z,0001636289
ACVA,ACV Auctions Inc.,stocks,us,XNYS,CS,True,usd,BBG00G5JGQ66,BBG00G5JGQ75,2025-12-02T07:05:58.603956227Z,0001637873
ACVF,American Conservative Values ETF,stocks,us,ARCX,ETF,True,usd,BBG00Y04Q9T7,BBG00Y04QBN8,2025-12-02T07:05:58.603956357Z,
ACVT,Advent Convertible Bond ETF,stocks,us,ARCX,ETF,True,usd,BBG01TQ0YGP6,BBG01TQ0YHK9,2025-12-02T07:05:58.603956538Z,
ACWI,iShares MSCI ACWI ETF,stocks,us,XNAS,ETF,True,usd,BBG000TH6VB3,BBG001S56QV7,2025-12-02T07:05:58.603956698Z,0001100663
ACWV,iShares MSCI Global Min Vol Factor ETF,stocks,us,BATS,ETF,True,usd,BBG0025X38X0,BBG0025X39Q6,2025-12-02T07:05:58.603956828Z,0001100663
ACWX,iShares MSCI ACWI ex US ETF,stocks,us,XNAS,ETF,True,usd,BBG000TH7DF8,BBG001S56R18,2025-12-02T07:05:58.603957079Z,0001100663
ACXP,"Acurx Pharmaceuticals, Inc. Common Stock",stocks,us,XNAS,CS,True,usd,BBG01184DNJ4,BBG01184DNK2,2025-12-02T07:05:58.603957189Z,0001736243
AD,"Array Digital Infrastructure, Inc.",stocks,us,XNYS,CS,True,usd,BBG000BW6P59,BBG001S5X446,2025-12-02T07:05:58.603957309Z,0000821130
ADAG,Adagene Inc. American Depositary Shares,stocks,us,XNAS,ADRC,True,usd,BBG00YZ6BYJ6,BBG00YZ6BZC0,2025-12-02T07:05:58.60395767Z,0001818838
ADAM,"Adamas Trust, Inc. Common Stock",stocks,us,XNAS,CS,True,usd,BBG000GZ8014,BBG001SHHBR7,2025-12-02T07:05:58.6039578Z,0001273685
ADAMG,"Adamas Trust, Inc. 9.125% Senior Notes Due 2030",stocks,us,XNAS,CS,True,usd,,,2025-12-02T07:05:58.603958071Z,0001273685
ADAMH,"Adamas Trust, Inc. 9.875% Senior Notes Due 2030",stocks,us,XNAS,CS,True,usd,,,2025-12-02T07:05:58.603958241Z,0001273685
ADAMI,"Adamas Trust, Inc. 9.125% Senior Notes Due 2029",stocks,us,XNAS,CS,True,usd,,,2025-12-02T07:05:58.603958411Z,0001273685
ADAML,"Adamas Trust, Inc. 6.875% Series F Fixed-to-Floating Rate Cumulative Redeemable Preferred Stock, $0.01 par value per share",stocks,us,XNAS,CS,True,usd,,,2025-12-02T07:05:58.603958532Z,0001273685
ADAMM,"Adamas Trust, Inc. 7.875% Series E Fixed-to-Floating Rate Cumulative Redeemable Preferred Stock",stocks,us,XNAS,PFD,True,usd,,,2025-12-02T07:05:58.603959083Z,0001273685
ADAMN,"Adamas Trust, Inc. 8.00% Series D Fixed-to-Floating Rate Cumulative Redeemable Preferred Stock",stocks,us,XNAS,PFD,True,usd,,,2025-12-02T07:05:58.603959203Z,0001273685
ADAMZ,"Adamas Trust, Inc. 7.000% Series G Cumulative Redeemable Preferred Stock, $0.01 par value per share",stocks,us,XNAS,CS,True,usd,,,2025-12-02T07:05:58.603959333Z,0001273685
ADBE,Adobe Inc.,stocks,us,XNAS,CS,True,usd,BBG000BB5006,BBG001S5NCQ5,2025-12-02T07:05:58.603959453Z,0000796343
ADBG,Leverage Shares 2X Long ADBE Daily ETF,stocks,us,XNAS,ETF,True,usd,BBG01SWP6HM8,BBG01SWP6JH0,2025-12-02T07:05:58.603959564Z,0001976322
ADC,Agree Realty Corporation,stocks,us,XNYS,CS,True,usd,BBG000BC9DK0,BBG001S6RY81,2025-12-02T07:05:58.603959704Z,0000917251
ADCT,ADC Therapeutics SA,stocks,us,XNYS,CS,True,usd,,,2025-12-02T07:05:58.603959814Z,0001771910
ADCpA,"Agree Realty Corporation Depositary Shares, each representing 1/1,000th of a 4.250% Series A Cumulative Redeemable Preferred Stock",stocks,us,XNYS,PFD,True,usd,,,2025-12-02T07:05:58.603959934Z,0000917251
ADEA,Adeia Inc. Common Stock,stocks,us,XNAS,CS,True,usd,BBG00RBFBL50,BBG00RBFBL78,2025-12-02T07:05:58.603960054Z,0001803696
ADFI,Anfield Dynamic Fixed Income ETF,stocks,us,BATS,ETF,True,usd,BBG00WRFGTJ5,BBG00WRFGV91,2025-12-02T07:05:58.603960175Z,0001552947
ADGM,"Adagio Medical Holdings, Inc Common Stock",stocks,us,XNAS,CS,True,usd,BBG01P202S42,BBG01P202S60,2025-12-02T07:05:58.603960595Z,0002006986
ADI,"Analog Devices, Inc.",stocks,us,XNAS,CS,True,usd,BBG000BB6G37,BBG001S5ND38,2025-12-02T07:05:58.603960716Z,0000006281
ADIL,"Adial Pharmaceuticals, Inc",stocks,us,XNAS,CS,True,usd,BBG00HNGDTR4,BBG00HNGDTS3,2025-12-02T07:05:58.603960836Z,0001513525
ADIV,Guinness Atkinson Asia Pacific Dividend Builder ETF,stocks,us,ARCX,ETF,True,usd,BBG00ZV17TH6,BBG00ZV17VD5,2025-12-02T07:05:58.603961076Z,
ADM,Archer Daniels Midland Company,stocks,us,XNYS,CS,True,usd,BBG000BB6WG8,BBG001S5ND74,2025-12-02T07:05:58.603961227Z,0000007084
ADMA,"ADMA Biologics, Inc.",stocks,us,XNAS,CS,True,usd,BBG002NCK5M5,BBG002NCK5N4,2025-12-02T07:05:58.603961367Z,0001368514
ADME,Aptus Behavioral Momentum ETF,stocks,us,BATS,ETF,True,usd,BBG00D20HG22,BBG00D20HG31,2025-12-02T07:05:58.603961487Z,0001539639
ADNT,Adient plc Ordinary Shares,stocks,us,XNYS,CS,True,usd,,,2025-12-02T07:05:58.603961688Z,0001670541
ADP,Automatic Data Processing,stocks,us,XNAS,CS,True,usd,BBG000JG0547,BBG001S82KF6,2025-12-02T07:05:58.603961798Z,0000008670
ADPT,Adaptive Biotechnologies Corporation Common Stock,stocks,us,XNAS,CS,True,usd,BBG001J2PFF5,BBG001V0GG18,2025-12-02T07:05:58.603961928Z,0001478320
ADPV,Adaptiv Select ETF,stocks,us,ARCX,ETF,True,usd,BBG01BBJQ2C4,BBG01BBJQ3B3,2025-12-02T07:05:58.603962078Z,
ADSE,ADS-TEC ENERGY PLC Ordinary Shares,stocks,us,XNAS,CS,True,usd,,,2025-12-02T07:05:58.603962259Z,0001879248
ADSEW,ADS-TEC ENERGY PLC Warrant,stocks,us,XNAS,WARRANT,True,usd,,,2025-12-02T07:05:58.603962379Z,0001879248
ADSK,Autodesk Inc,stocks,us,XNAS,CS,True,usd,BBG000BM7HL0,BBG001S5SCD4,2025-12-02T07:05:58.603962499Z,0000769397
ADT,ADT Inc.,stocks,us,XNYS,CS,True,usd,BBG000BP9WJ1,BBG001S6VGG6,2025-12-02T07:05:58.603962619Z,0001703056
ADTN,"ADTRAN Holdings, Inc. Common Stock",stocks,us,XNAS,CS,True,usd,BBG0169CH7X9,BBG0169CH7Y8,2025-12-02T07:05:58.60396273Z,0000926282
ADTX,"Aditxt, Inc. Common Stock",stocks,us,XNAS,CS,True,usd,BBG00RDV1WS5,BBG00RDV1WT4,2025-12-02T07:05:58.60396299Z,0001726711
ADUR,Aduro Clean Technologies Inc. Common Stock,stocks,us,XNAS,CS,True,usd,BBG011F62496,BBG00N9ZZX01,2025-12-02T07:05:58.60396311Z,0001863934
ADUS,Addus HomeCare Corp.,stocks,us,XNAS,CS,True,usd,BBG000NJGX84,BBG001T56D18,2025-12-02T07:05:58.603963241Z,0001468328
ADV,Advantage Solutions Inc. Class A Common Stock,stocks,us,XNAS,CS,True,usd,BBG00PPWZ8C7,BBG00PPWZ8G3,2025-12-02T07:05:58.603963371Z,0001776661
ADVB,Advanced Biomed Inc. Common Stock,stocks,us,XNAS,CS,True,usd,BBG01HW4B3M4,BBG01HW4B3N3,2025-12-02T07:05:58.603963511Z,0001941029
ADVE,Matthews Asia Dividend Active ETF,stocks,us,ARCX,ETF,True,usd,BBG01JFHH825,BBG01JFHH923,2025-12-02T07:05:58.603963631Z,
ADVM,"Adverum Biotechnologies, Inc. Common Stock",stocks,us,XNAS,CS,True,usd,BBG006D9MR17,BBG006D9MR26,2025-12-02T07:05:58.603963751Z,0001501756
ADX,"Adams Diversified Equity Fund, Inc",stocks,us,XNYS,FUND,True,usd,BBG000BB8MR6,BBG001S5NDV7,2025-12-02T07:05:58.603963872Z,0000002230
ADXN,Addex Therapeutics Ltd American Depositary Shares,stocks,us,XNAS,ADRC,True,usd,BBG00R48ST95,BBG00R48SV18,2025-12-02T07:05:58.603963992Z,0001574232
AEBI,Aebi Schmidt Holding AG Common Stock,stocks,us,XNAS,CS,True,usd,,,2025-12-02T07:05:58.603964122Z,0002048519
AEC,Anfield Energy Inc. Common Shares,stocks,us,XNAS,CS,True,usd,BBG002PL1DW6,BBG001V114Z2,2025-12-02T07:05:58.603964242Z,0001519469
AEE,Ameren Corporation,stocks,us,XNYS,CS,True,usd,BBG000B9X8C0,BBG001S5NF24,2025-12-02T07:05:58.603964363Z,0001002910
AEF,"abrdn Emerging Markets ex-China Fund, Inc.",stocks,us,XASE,FUND,True,usd,BBG000BGWCV5,BBG001S5QCR1,2025-12-02T07:05:58.603964483Z,0000846676
AEFC,Aegon Funding Company LLC 5.10% Subordinated Notes due 2049,stocks,us,XNYS,SP,True,usd,,,2025-12-02T07:05:58.603964603Z,0000769218
AEG,Aegon Ltd.,stocks,us,XNYS,CS,True,usd,BBG000CKQSN6,BBG001S6Y6M8,2025-12-02T07:05:58.603964723Z,0000769218
AEHL,Antelope Enterprise Holdings Limited Class A Ordinary Shares,stocks,us,XNAS,CS,True,usd,,,2025-12-02T07:05:58.603964994Z,0001470683
AEHR,Aehr Test Systems,stocks,us,XNAS,CS,True,usd,BBG000BWM083,BBG001SB1CS4,2025-12-02T07:05:58.603965495Z,0001040470
