ticker,name,market,locale,primary_exchange,type,active,currency_name,composite_figi,share_class_figi,last_updated_utc,cik
FEBM,FT Vest U.S. Equity Max Buffer ETF - February,stocks,us,BATS,ETF,True,usd,BBG01SCJVH19,BBG01SCJVJ06,2025-12-01T07:05:47.196064299Z,0001667919
FEBO,Fenbo Holdings Limited Class A Ordinary Shares,stocks,us,XNAS,CS,True,usd,,,2025-12-01T07:05:47.19606442Z,0001957001
FEBP,PGIM S&P 500 Buffer 12 ETF - February,stocks,us,BATS,ETF,True,usd,BBG01L5NJGH2,BBG01L5NJHC5,2025-12-01T07:05:47.19606457Z,
FEBT,AllianzIM U.S. Large Cap Buffer10 Feb ETF,stocks,us,ARCX,ETS,True,usd,BBG01DC8X9J3,BBG01DC8XBD4,2025-12-01T07:05:47.19606469Z,0001797318
FEBU,AllianzIM U.S. Equity Buffer15 Uncapped Feb ETF,stocks,us,BATS,ETF,True,usd,BBG01RXTJLM8,BBG01RXTJMK8,2025-12-01T07:05:47.196065061Z,0001797318
FEBW,AllianzIM U.S. Large Cap Buffer20 Feb ETF,stocks,us,ARCX,ETS,True,usd,BBG01DCCD5M0,BBG01DCCD6G5,2025-12-01T07:05:47.196065321Z,0001797318
FEBZ,TrueShares Structured Outcome (February) ETF,stocks,us,BATS,ETF,True,usd,BBG01WJZKSF0,BBG01WJZKTH6,2025-12-01T07:05:47.196065442Z,0001776878
FEDM,FlexShares ESG & Climate Developed Markets ex-US Core Index Fund,stocks,us,ARCX,ETF,True,usd,BBG012N0R9T8,BBG012N0RBN9,2025-12-01T07:05:47.196065562Z,0001491978
FEDU,"Four Seasons Education (Cayman) Inc. American depositary shares, each representing ten (10) Ordinary Shares",stocks,us,XNYS,ADRC,True,usd,BBG00HZ6NWR5,BBG00HZ6NWS4,2025-12-01T07:05:47.196065682Z,0001709819
FEGE,First Eagle Global Equity ETF,stocks,us,XNYS,ETF,True,usd,BBG01R35L769,BBG01R35L858,2025-12-01T07:05:47.196065812Z,
FEIG,FlexShares ESG & Climate Investment Grade Corporate Core Index Fund,stocks,us,ARCX,ETF,True,usd,BBG012N0QH39,BBG012N0QJ08,2025-12-01T07:05:47.196065933Z,0001491978
FEIM,"Frequency Electronics, Inc.",stocks,us,XNAS,CS,True,usd,BBG000BJG3B9,BBG001S5R3V5,2025-12-01T07:05:47.196066053Z,0000039020
FELC,Fidelity Enhanced Large Cap Core ETF,stocks,us,ARCX,ETF,True,usd,BBG01K4JD1F5,BBG01K4JD281,2025-12-01T07:05:47.196066694Z,0000945908
FELE,Franklin Electric Co Inc,stocks,us,XNAS,CS,True,usd,BBG000BJGGV8,BBG001S5R3W4,2025-12-01T07:05:47.196066924Z,0000038725
FELG,Fidelity Enhanced Large Cap Growth ETF,stocks,us,ARCX,ETF,True,usd,BBG01K4K7ZF4,BBG01K4K80N1,2025-12-01T07:05:47.196067045Z,0000945908
FELV,Fidelity Enhanced Large Cap Value ETF,stocks,us,ARCX,ETF,True,usd,BBG01K786HR6,BBG01K786JL8,2025-12-01T07:05:47.196067195Z,0000945908
FEM,First Trust Emerging Markets AlphaDEX Fund,stocks,us,XNAS,ETF,True,usd,BBG001MKMZJ6,BBG001V11W80,2025-12-01T07:05:47.196067325Z,0001510337
FEMB,First Trust Emerging Markets Local Currency Bond ETF,stocks,us,XNAS,ETF,True,usd,BBG007GFNNZ9,BBG007GFNP02,2025-12-01T07:05:47.196067455Z,0001424212
FEMR,Fidelity Enhanced Emerging Markets ETF,stocks,us,ARCX,ETF,True,usd,BBG01QWJS5T1,BBG01QWJS753,2025-12-01T07:05:47.196067936Z,0000945908
FEMS,First Trust Emerging Markets Small Cap AlphaDEX Fund,stocks,us,XNAS,ETF,True,usd,BBG002NCPY10,BBG002NCPYS1,2025-12-01T07:05:47.196068758Z,0001364608
FEMY,Femasys Inc. Common Stock,stocks,us,XNAS,CS,True,usd,BBG004M23R63,BBG004M23R72,2025-12-01T07:05:47.196069089Z,0001339005
FENC,Fennec Pharmaceuticals Inc. Common Stock,stocks,us,XNAS,CS,True,usd,BBG000DTH814,BBG001S69M23,2025-12-01T07:05:47.196069209Z,0001211583
FENG,Phoenix New Media Limited American Depositary Shares (each representing forty-eight (48) Class A Ordinary Shares),stocks,us,XNYS,ADRC,True,usd,BBG001NKNH59,BBG001V14PZ2,2025-12-01T07:05:47.196069539Z,0001509646
FENI,Fidelity Enhanced International ETF,stocks,us,ARCX,ETF,True,usd,BBG01K4JLYL7,BBG01K4JLZG0,2025-12-01T07:05:47.19606968Z,0000945908
FENY,Fidelity MSCI Energy Index ETF,stocks,us,ARCX,ETF,True,usd,BBG005FHW2W9,BBG005FHW2X8,2025-12-01T07:05:47.19606989Z,0000945908
FEOE,First Eagle Overseas Equity ETF,stocks,us,XNYS,ETF,True,usd,BBG01R35FFF8,BBG01R35FG93,2025-12-01T07:05:47.19607002Z,
FEP,First Trust Europe AlphaDEX Fund,stocks,us,XNAS,ETF,True,usd,BBG001MKQKC2,BBG001V11YX8,2025-12-01T07:05:47.196070161Z,0001510337
FEPI,REX FANG & Innovation Equity Premium Income ETF,stocks,us,XNAS,ETF,True,usd,BBG01JNC0V42,BBG01JNC0VZ8,2025-12-01T07:05:47.196070281Z,0000726516
FER,Ferrovial SE Ordinary Shares,stocks,us,XNAS,CS,True,usd,,,2025-12-01T07:05:47.196070401Z,0001468522
FERA,Fifth Era Acquisition Corp I Class A Ordinary Shares,stocks,us,XNAS,CS,True,usd,,,2025-12-01T07:05:47.196070521Z,0002025401
FERAR,Fifth Era Acquisition Corp I Rights,stocks,us,XNAS,RIGHT,True,usd,,,2025-12-01T07:05:47.196070632Z,0002025401
FERAU,Fifth Era Acquisition Corp I Units,stocks,us,XNAS,UNIT,True,usd,,,2025-12-01T07:05:47.196070892Z,0002025401
FERG,Ferguson Enterprises Inc.,stocks,us,XNYS,CS,True,usd,BBG01NMRD768,BBG01NMRD786,2025-12-01T07:05:47.196071102Z,0002011641
FESM,Fidelity Enhanced Small Cap ETF,stocks,us,ARCX,ETF,True,usd,BBG01K786LQ8,BBG01K786ML1,2025-12-01T07:05:47.196071603Z,0000945908
FET,"Forum Energy Technologies, Inc.",stocks,us,XNYS,CS,True,usd,BBG000PDVKL1,BBG001SR1425,2025-12-01T07:05:47.196071884Z,0001401257
FETH,Fidelity Ethereum Fund,stocks,us,BATS,ETF,True,usd,BBG01NWVKPS6,BBG01NWVKQP7,2025-12-01T07:05:47.196071994Z,0002000046
FEUS,FlexShares ESG & Climate US Large Cap Core Index Fund,stocks,us,ARCX,ETF,True,usd,BBG012N0PLQ6,BBG012N0PML9,2025-12-01T07:05:47.196072134Z,0001491978
FEUZ,First Trust Eurozone AlphaDEX,stocks,us,XNAS,ETF,True,usd,BBG007D9BXL2,BBG007D9BXM1,2025-12-01T07:05:47.196072285Z,0001510337
FEX,First Trust Large Cap Core AlphaDEX Fund,stocks,us,XNAS,ETF,True,usd,BBG000R6D2Y0,BBG001ST68X3,2025-12-01T07:05:47.196072405Z,
FEZ,SPDR EURO STOXX 50 ETF,stocks,us,ARCX,ETF,True,usd,BBG000PG8230,BBG001SLBK12,2025-12-01T07:05:47.196072515Z,0001168164
FF,Future Fuel Corporation,stocks,us,XNYS,CS,True,usd,BBG000GDSKT7,BBG001SNX0W4,2025-12-01T07:05:47.196072736Z,0001337298
FFA,First Trust Enhanced Equity Income Fund.,stocks,us,XNYS,FUND,True,usd,BBG000PZFW98,BBG001SLZBJ7,2025-12-01T07:05:47.196072866Z,0001291334
FFAI,Faraday Future Intelligent Electric Inc. Common Stock,stocks,us,XNAS,CS,True,usd,BBG00W4M4KW2,BBG00W4M4LN0,2025-12-01T07:05:47.196072996Z,0001805521
FFAIW,Faraday Future Intelligent Electric Inc. Warrant,stocks,us,XNAS,WARRANT,True,usd,BBG00WYY6PR6,,2025-12-01T07:05:47.196073126Z,0001805521
FFBC,First Financial Bancorp,stocks,us,XNAS,CS,True,usd,BBG000BJGW43,BBG001S5R4C4,2025-12-01T07:05:47.196073246Z,0000708955
FFC,Flaherty & Crumrine Preferred and Income Securities Fund Incorporated,stocks,us,XNYS,FUND,True,usd,BBG000K0ML78,BBG001SJF1Q8,2025-12-01T07:05:47.196073367Z,0001174164
FFDI,Fidelity Fundamental Developed International ETF,stocks,us,BATS,ETF,True,usd,BBG01QWK4GX5,BBG01QWK4J96,2025-12-01T07:05:47.196073487Z,0000945908
FFEB,FT Vest U.S. Equity Buffer ETF - February,stocks,us,BATS,ETF,True,usd,BBG00RPK2MH9,BBG00RPK2N78,2025-12-01T07:05:47.196073607Z,0001667919
FFEM,Fidelity Fundamental Emerging Markets ETF,stocks,us,BATS,ETF,True,usd,BBG01QVWMR75,BBG01QVWMS46,2025-12-01T07:05:47.196073717Z,0000945908
FFGX,Fidelity Fundamental Global ex-U.S. ETF,stocks,us,BATS,ETF,True,usd,BBG01QWK8FZ1,BBG01QWK8H23,2025-12-01T07:05:47.196074118Z,0000945908
FFIC,Flushing Financial Corp,stocks,us,XNAS,CS,True,usd,BBG000BZRV74,BBG001S7KQM7,2025-12-01T07:05:47.196074359Z,0000923139
FFIN,First Financial Bankshares Inc,stocks,us,XNAS,CS,True,usd,BBG000BL8476,BBG001S7HCY9,2025-12-01T07:05:47.196074539Z,0000036029
FFIU,UVA Unconstrained Medium-Term Fixed Income ETF,stocks,us,ARCX,ETF,True,usd,BBG00HG93369,BBG00HG933X9,2025-12-01T07:05:47.196074649Z,0001484018
FFIV,"F5, Inc. Common Stock",stocks,us,XNAS,CS,True,usd,BBG000CXYSZ6,BBG001SCP8D1,2025-12-01T07:05:47.19607503Z,0001048695
FFLC,Fidelity Fundamental Large Cap Core ETF,stocks,us,BATS,ETF,True,usd,BBG00V6QF9V7,BBG00V6QFBM2,2025-12-01T07:05:47.19607515Z,0000945908
FFLG,Fidelity Fundamental Large Cap Growth ETF,stocks,us,BATS,ETF,True,usd,BBG00Z4JFLJ3,BBG00Z4JFMC8,2025-12-01T07:05:47.19607526Z,0000945908
FFLS,The Future Fund Long/Short ETF,stocks,us,ARCX,ETF,True,usd,BBG01H3PF9N1,BBG01H3PFBH3,2025-12-01T07:05:47.196075391Z,
FFLV,Fidelity Fundamental Large Cap Value ETF,stocks,us,BATS,ETF,True,usd,BBG01LH0M9N4,BBG01LH0MBJ4,2025-12-01T07:05:47.196075571Z,0000945908
FFND,One Global ETF,stocks,us,ARCX,ETF,True,usd,BBG01292NBL7,BBG01292NCG1,2025-12-01T07:05:47.196075711Z,
FFOG,Franklin Focused Growth ETF,stocks,us,BATS,ETF,True,usd,BBG01JZGNP93,BBG01JZGNQ64,2025-12-01T07:05:47.196075831Z,0001655589
FFOX,FundX Future Fund Opportunities ETF,stocks,us,ARCX,ETF,True,usd,BBG01VG8NHG5,BBG01VG8NKH7,2025-12-01T07:05:47.196075952Z,
FFSM,Fidelity Fundamental Small-Mid Cap ETF,stocks,us,BATS,ETF,True,usd,BBG00Z4JGTT4,BBG00Z4JGVP3,2025-12-01T07:05:47.196076092Z,0000945908
FFTY,Innovator IBD 50 ETF,stocks,us,ARCX,ETF,True,usd,BBG008G60GX9,BBG008G60GY8,2025-12-01T07:05:47.196076212Z,0001482688
FFUT,Fidelity Managed Futures ETF,stocks,us,XNAS,ETF,True,usd,BBG01VBP2H66,BBG01VBP2J35,2025-12-01T07:05:47.196076332Z,0001898391
FFWM,First Foundation Inc.,stocks,us,XNYS,CS,True,usd,BBG001V9VY04,BBG001V9VY13,2025-12-01T07:05:47.196076453Z,0001413837
FG,"F&G Annuities & Life, Inc.",stocks,us,XNYS,CS,True,usd,BBG01BGVGG87,BBG01BGVGH85,2025-12-01T07:05:47.196076823Z,0001934850
FGBI,FIRST GUARANTY BANCSHARES INC,stocks,us,XNAS,CS,True,usd,BBG000BRLPF2,BBG001SCGLY9,2025-12-01T07:05:47.196077054Z,0001408534
FGBIP,"First Guaranty Bancshares, Inc. 6.75% Series A Fixed-Rate Non-Cumulative Perpetual Preferred Stock",stocks,us,XNAS,PFD,True,usd,,,2025-12-01T07:05:47.196077284Z,0001408534
FGD,First Trust Dow Jones Global Select Dividend Index Fund,stocks,us,ARCX,ETF,True,usd,BBG000TYHFH3,BBG001T0S727,2025-12-01T07:05:47.196077424Z,0001364608
FGDL,Franklin Responsibly Sourced Gold ETF,stocks,us,ARCX,ETV,True,usd,BBG018KX3Q23,BBG018KX3R21,2025-12-01T07:05:47.196077565Z,0001858258
FGEN,"FibroGen, Inc",stocks,us,XNAS,CS,True,usd,BBG000FW5ZL6,BBG001SN7DS0,2025-12-01T07:05:47.196077695Z,0000921299
FGI,FGI Industries Ltd. Ordinary Shares,stocks,us,XNAS,CS,True,usd,,,2025-12-01T07:05:47.196077815Z,0001864943
FGIWW,FGI Industries Ltd. Warrant,stocks,us,XNAS,WARRANT,True,usd,,,2025-12-01T07:05:47.196077935Z,0001864943
FGL,Founder Group Limited Class A Ordinary Shares,stocks,us,XNAS,CS,True,usd,,,2025-12-01T07:05:47.196078196Z,0001989930
FGM,First Trust Germany AlphaDEX Fund,stocks,us,XNAS,ETF,True,usd,BBG002N8WN24,BBG002N8WNT5,2025-12-01T07:05:47.196078306Z,0001510337
FGMC,FG Merger II Corp. Common stock,stocks,us,XNAS,CS,True,usd,BBG01R78HB10,BBG01R78HC09,2025-12-01T07:05:47.196078496Z,0001906364
FGMCR,FG Merger II Corp. Rights,stocks,us,XNAS,RIGHT,True,usd,BBG01S6Z71F7,BBG01S6Z72D7,2025-12-01T07:05:47.196078617Z,0001906364
FGMCU,FG Merger II Corp. Unit,stocks,us,XNAS,UNIT,True,usd,BBG01JX8BW55,BBG01JX8BW64,2025-12-01T07:05:47.196078737Z,0001906364
FGN,"F&G Annuities & Life, Inc. 7.950% Senior Notes due 2053",stocks,us,XNYS,SP,True,usd,,,2025-12-01T07:05:47.196078867Z,0001934850
FGNX,FG Nexus Inc. Common Stock,stocks,us,XNAS,CS,True,usd,BBG01BY3XPZ0,BBG01BY3XQ06,2025-12-01T07:05:47.196078997Z,0001591890
FGNXP,FG Nexus Inc. 8.00% Cumulative Preferred Stock,stocks,us,XNAS,PFD,True,usd,,,2025-12-01T07:05:47.196079118Z,0001591890
FGSI,FT Vest Growth Strength & Target Income ETF,stocks,us,XNAS,ETF,True,usd,BBG01VR0JJ35,BBG01VR0JK14,2025-12-01T07:05:47.196079579Z,0001517936
FGSM,Frontier Asset Global Small Cap Equity ETF,stocks,us,ARCX,ETF,True,usd,BBG01RB8T7B0,BBG01RB8T873,2025-12-01T07:05:47.196079979Z,
FGSN,"F&G Annuities & Life, Inc. 7.300% Junior Subordinated Notes due 2065",stocks,us,XNYS,SP,True,usd,,,2025-12-01T07:05:47.1960801Z,0001934850
FHB,"First Hawaiian, Inc. Common Stock",stocks,us,XNAS,CS,True,usd,BBG0046LJYT2,BBG0046LJYX7,2025-12-01T07:05:47.19608022Z,0000036377
FHDG,FT Vest U.S. Equity Quarterly Dynamic Buffer ETF,stocks,us,BATS,ETF,True,usd,BBG01QQXJ303,BBG01QQXJ3V9,2025-12-01T07:05:47.19608035Z,0001667919
FHEQ,Fidelity Hedged Equity ETF,stocks,us,BATS,ETF,True,usd,BBG01M5HQNM4,BBG01M5HQQ01,2025-12-01T07:05:47.19608046Z,0001898391
FHI,"Federated Hermes, Inc.",stocks,us,XNYS,CS,True,usd,BBG000BP0929,BBG001S6TGK4,2025-12-01T07:05:47.19608059Z,0001056288
FHLC,Fidelity MSCI Health Care Index ETF,stocks,us,ARCX,ETF,True,usd,BBG005FHVV47,BBG005FHVV56,2025-12-01T07:05:47.196080711Z,0000945908
FHN,First Horizon Corporation,stocks,us,XNYS,CS,True,usd,BBG000GHZSZ6,BBG001SCW8R8,2025-12-01T07:05:47.196080831Z,0000036966
FHNpC,"First Horizon Corporation Depositary Shares, each representing a 1/400th interest in a share of Non-Cumulative Perpetual Preferred Stock, Series C",stocks,us,XNYS,PFD,True,usd,,,2025-12-01T07:05:47.196080941Z,0000036966
FHNpE,"First Horizon Corporation Depositary Shares, Each Representing a 1/ 4000th Interest in a Share of Non-cumulative Perpetual Series E Preferred Stock",stocks,us,XNYS,PFD,True,usd,,,2025-12-01T07:05:47.196081061Z,0000036966
FHNpF,"First Horizon Corporation Depositary Shares, each representing 1/4000th Interest in a Share of Non-Cumulative Perpetual Preferred Stock, Series F",stocks,us,XNYS,PFD,True,usd,,,2025-12-01T07:05:47.196081172Z,0000036966
FHTX,Foghorn Therapeutics Inc. Common Stock,stocks,us,XNAS,CS,True,usd,BBG00HFZPB88,BBG00HFZPB97,2025-12-01T07:05:47.196081292Z,0001822462
FHYS,Federated Hermes Short Duration High Yield ETF,stocks,us,ARCX,ETF,True,usd,BBG013BTDBC4,BBG013BTDC87,2025-12-01T07:05:47.196081412Z,0001849998
FIAT,YieldMax Short COIN Option Income Strategy ETF,stocks,us,ARCX,ETS,True,usd,BBG01NP80C42,BBG01NP80D31,2025-12-01T07:05:47.196081532Z,0001924868
FIAX,Nicholas Fixed Income Alternative ETF,stocks,us,ARCX,ETF,True,usd,BBG01BTRTQK2,BBG01BTRTRF6,2025-12-01T07:05:47.196081652Z,
FIBK,"First Interstate BancSystem, Inc. Common Stock (DE)",stocks,us,XNAS,CS,True,usd,BBG000BMSC38,BBG001S9F1B6,2025-12-01T07:05:47.196082524Z,0000860413
FICO,Fair Isaac Corporation,stocks,us,XNYS,CS,True,usd,BBG000DW76Y6,BBG001S8ZT61,2025-12-01T07:05:47.196082654Z,0000814547
FICS,First Trust International Developed Capital Strength ETF,stocks,us,XNAS,ETF,True,usd,BBG00YGCBLZ4,BBG00YGCBMV6,2025-12-01T07:05:47.196082985Z,0001552740
FID,First Trust Exchange-Traded Fund VI First Trust S&P International Dividend Aristocrats ETF,stocks,us,XNAS,ETF,True,usd,BBG0055FL7F4,BBG0055FL7G3,2025-12-01T07:05:47.196083105Z,0001552740
FIDI,Fidelity International High Dividend ETF,stocks,us,ARCX,ETF,True,usd,BBG00JRH22Y7,BBG00JRH23N7,2025-12-01T07:05:47.196083225Z,0000945908
FIDU,Fidelity MSCI Industrials Index ETF,stocks,us,ARCX,ETF,True,usd,BBG005FHVVY4,BBG005FHVVZ3,2025-12-01T07:05:47.196083346Z,0000945908
FIEE,"FiEE, Inc Common Stock",stocks,us,XNAS,CS,True,usd,BBG000LDSKW7,BBG001T495P9,2025-12-01T07:05:47.196083486Z,0001467761
FIG,"Figma, Inc.",stocks,us,XNYS,CS,True,usd,BBG00BLZ2CD1,BBG00BLZ2CF9,2025-12-01T07:05:47.196083606Z,0001579878
FIGB,Fidelity Investment Grade Bond ETF,stocks,us,ARCX,ETF,True,usd,BBG00ZGX8833,BBG00ZGX8904,2025-12-01T07:05:47.196083726Z,0001562565
FIGG,Leverage Shares 2x Long FIG Daily ETF,stocks,us,XNAS,ETF,True,usd,BBG01XV8VB69,BBG01XV8VC30,2025-12-01T07:05:47.196083847Z,
FIGR,"Figure Technology Solutions, Inc. Class A Common Stock",stocks,us,XNAS,CS,True,usd,BBG01NGH78G1,BBG01NGH78K6,2025-12-01T07:05:47.196084237Z,0002064124
FIGS,"FIGS, Inc.",stocks,us,XNYS,CS,True,usd,BBG004SK5VL9,BBG004SK5VM8,2025-12-01T07:05:47.196084378Z,0001846576
FIGX,FIGX Capital Acquisition Corp. Class A Ordinary Share,stocks,us,XNAS,CS,True,usd,,,2025-12-01T07:05:47.196084498Z,0002059033
FIGXU,FIGX Capital Acquisition Corp. Units,stocks,us,XNAS,UNIT,True,usd,,,2025-12-01T07:05:47.196084628Z,0002059033
FIGXW,FIGX Capital Acquisition Corp. Warrant,stocks,us,XNAS,WARRANT,True,usd,,,2025-12-01T07:05:47.196084748Z,0002059033
FIHL,Fidelis Insurance Holdings Limited,stocks,us,XNYS,CS,True,usd,,,2025-12-01T07:05:47.196085029Z,0001636639
FIIG,First Trust Intermediate Duration Investment Grade Corporate ETF,stocks,us,ARCX,ETF,True,usd,BBG01HPQFCW8,BBG01HPQFDQ3,2025-12-01T07:05:47.1960854Z,0001517936
FINS,Angel Oak Financial Strategies Income Term Trust,stocks,us,XNYS,FUND,True,usd,BBG00P48H7P1,BBG00P48H8F0,2025-12-01T07:05:47.19608553Z,0001745059
FINT,Frontier Asset Total International Equity ETF,stocks,us,ARCX,ETF,True,usd,BBG01RBB3ZR2,BBG01RBB4132,2025-12-01T07:05:47.1960857Z,
FINV,"FinVolution Group American depositary shares, each representing five Class A ordinary shares",stocks,us,XNYS,ADRC,True,usd,BBG00HZ6P0P5,BBG00HZ6P0Q4,2025-12-01T07:05:47.19608582Z,0001691445
FINW,FinWise Bancorp Common,stocks,us,XNAS,CS,True,usd,BBG011VF9YT3,BBG011VF9ZN6,2025-12-01T07:05:47.196085951Z,0001856365
FINX,Global X Funds Global X FinTech ETF,stocks,us,XNAS,ETF,True,usd,BBG00DSB46W3,BBG00DSB46V4,2025-12-01T07:05:47.196086071Z,0001432353
FIP,FTAI Infrastructure Inc. Common Stock,stocks,us,XNAS,CS,True,usd,BBG0174VKJ51,BBG0174VKJB4,2025-12-01T07:05:47.196086231Z,0001899883
FIS,"Fidelity National Information Services, Inc.",stocks,us,XNYS,CS,True,usd,BBG000BK2F42,BBG001S8SWQ0,2025-12-01T07:05:47.196086402Z,0001136893
FISI,Financial Institutions Inc,stocks,us,XNAS,CS,True,usd,BBG000BY1L13,BBG001SCY2P1,2025-12-01T07:05:47.196086532Z,0000862831
FISK,"Empire State Realty OP, L.P. Series 250",stocks,us,ARCX,UNIT,True,usd,BBG005CL7974,BBG005CL79Z3,2025-12-01T07:05:47.196086662Z,0001553079
FISR,State Street Fixed Income Sector Rotation ETF,stocks,us,ARCX,ETF,True,usd,BBG00NS9WGV4,BBG00NS9WHL3,2025-12-01T07:05:47.196086792Z,0001516212
FISV,"Fiserv, Inc. Common Stock",stocks,us,XNAS,CS,True,usd,BBG000BJKPG0,BBG001S5R6Q4,2025-12-01T07:05:47.196086912Z,0000798354
FITB,Fifth Third Bancorp,stocks,us,XNAS,CS,True,usd,BBG000BJL3N0,BBG001S5R6S2,2025-12-01T07:05:47.196087043Z,0000035527
FITBI,Fifth Third Bancorp Depositary Shares,stocks,us,XNAS,ADRC,True,usd,,,2025-12-01T07:05:47.196087173Z,0000035527
FITBO,"Fifth Third Bancorp Depositary Shares each representing a 1/1000th ownership interest in a share of Non-Cumulative Perpetual Preferred Stock, Series K",stocks,us,XNAS,CS,True,usd,,,2025-12-01T07:05:47.196087303Z,0000035527
FITBP,"Fifth Third Bancorp Depositary Shares each representing 1/40th share of Fifth Third 6.00% Non-Cumulative Perpetual Class B Preferred Stock, Series A",stocks,us,XNAS,PFD,True,usd,,,2025-12-01T07:05:47.196087423Z,0000035527
FITE,State Street SPDR S&P Kensho Future Security ETF,stocks,us,ARCX,ETF,True,usd,BBG00JHP6203,BBG00JHP62Q5,2025-12-01T07:05:47.196088045Z,0001081019
FIVA,Fidelity International Value Factor ETF,stocks,us,ARCX,ETF,True,usd,BBG00JRRWL07,BBG00JRRWLQ9,2025-12-01T07:05:47.196088345Z,0000945908
FIVE,"Five Below, Inc. Common Stock",stocks,us,XNAS,CS,True,usd,BBG001636CR2,BBG001TCDMY9,2025-12-01T07:05:47.196088626Z,0001177609
FIVN,"FIVE9, INC.",stocks,us,XNAS,CS,True,usd,BBG001KHJM17,BBG001V0P7K7,2025-12-01T07:05:47.196088756Z,0001288847
FIVY,YieldMax Dorsey Wright Hybrid 5 Income ETF,stocks,us,XNAS,ETF,True,usd,BBG01R76RP30,BBG01R76RQ01,2025-12-01T07:05:47.196088886Z,
FIW,First Trust Water ETF,stocks,us,ARCX,ETF,True,usd,BBG000QJSZL8,BBG001SS8248,2025-12-01T07:05:47.196089016Z,
FIX,"Comfort Systems USA, Inc.",stocks,us,XNYS,CS,True,usd,BBG000BWN2Y9,BBG001SB1GG8,2025-12-01T07:05:47.196089147Z,0001035983
FIXD,First Trust Exchange-Traded Fund VIII First Trust Smith Opportunistic Fixed Income ETF,stocks,us,XNAS,ETF,True,usd,BBG00FZ4KFH5,BBG00FZ4KG74,2025-12-01T07:05:47.196089277Z,0001667919
FIXP,FolioBeyond Enhanced Fixed Income Premium ETF,stocks,us,ARCX,ETF,True,usd,BBG01RXV73W5,BBG01RXV7587,2025-12-01T07:05:47.196089397Z,0001387131
FIXT,TCW Core Plus Bond ETF,stocks,us,XNYS,ETF,True,usd,BBG01THY0YQ9,BBG01THY0ZM0,2025-12-01T07:05:47.196089517Z,
FIZZ,National Beverage Corp.,stocks,us,XNAS,CS,True,usd,BBG000BF8CB6,BBG001S5PM18,2025-12-01T07:05:47.196089888Z,0000069891
FJAN,FT Vest U.S. Equity Buffer ETF - January,stocks,us,BATS,ETF,True,usd,BBG00YXMPKQ0,BBG00YXMPLL3,2025-12-01T07:05:47.196090008Z,0001667919
FJP,First Trust Japan AlphaDEX Fund,stocks,us,XNAS,ETF,True,usd,BBG001MKPY33,BBG001V11WW3,2025-12-01T07:05:47.196090399Z,0001510337
FJUL,FT Vest U.S. Equity Buffer ETF - July,stocks,us,BATS,ETF,True,usd,BBG00VZR6JH7,BBG00VZR6K84,2025-12-01T07:05:47.196090499Z,0001667919
FJUN,FT Vest U.S. Equity Buffer ETF - June,stocks,us,BATS,ETF,True,usd,BBG00VC9S427,BBG00VC9S4V5,2025-12-01T07:05:47.196090599Z,0001667919
FKU,First Trust United Kingdom AlphaDEX Fund,stocks,us,XNAS,ETF,True,usd,BBG002N8TF98,BBG002N8TG14,2025-12-01T07:05:47.1960907Z,0001510337
FKWL,Franklin Wireless Corp. Common Stock,stocks,us,XNAS,CS,True,usd,BBG000FS15V4,BBG001SBVBM9,2025-12-01T07:05:47.19609102Z,0000722572
FLAG,Global X S&P 500 U.S. Market Leaders Top 50 ETF,stocks,us,ARCX,ETF,True,usd,BBG01THDN636,BBG01THDN6Z1,2025-12-01T07:05:47.19609111Z,
FLAO,AllianzIM U.S. Equity 6 Month Floor5 Apr/Oct ETF,stocks,us,ARCX,ETS,True,usd,BBG01M34BY74,BBG01M34BZB6,2025-12-01T07:05:47.196091261Z,0001797318
FLAU,Franklin FTSE Australia ETF,stocks,us,ARCX,ETF,True,usd,BBG00J3M8WZ9,BBG00J3M8XP8,2025-12-01T07:05:47.196091371Z,0001655589
FLAX,Franklin FTSE Asia ex Japan ETF,stocks,us,ARCX,ETF,True,usd,BBG00JYXTH81,BBG00JYXTHZ1,2025-12-01T07:05:47.196091471Z,0001655589
FLBL,Franklin Senior Loan ETF,stocks,us,BATS,ETF,True,usd,BBG00L2CKS28,BBG00L2CKST9,2025-12-01T07:05:47.196091561Z,0001655589
FLBR,Franklin FTSE Brazil ETF,stocks,us,ARCX,ETF,True,usd,BBG00J3M9VQ0,BBG00J3M9WL3,2025-12-01T07:05:47.196091662Z,0001655589
FLC,Flaherty & Crumrine Total Return Fund Incorporated,stocks,us,XNYS,FUND,True,usd,BBG000PN2918,BBG001SLJ198,2025-12-01T07:05:47.196091762Z,0001245648
FLCA,Franklin FTSE Canada ETF,stocks,us,ARCX,ETF,True,usd,BBG00J3N6M72,BBG00J3N6MY2,2025-12-01T07:05:47.196092894Z,0001655589
FLCB,Franklin U.S. Core Bond ETF,stocks,us,ARCX,ETF,True,usd,BBG00Q6LNHW1,BBG00Q6LNJQ4,2025-12-01T07:05:47.196093014Z,0001655589
FLCC,Federated Hermes MDT Large Cap Core ETF,stocks,us,ARCX,ETF,True,usd,BBG01NK927B6,BBG01NK92888,2025-12-01T07:05:47.196093124Z,0001849998
FLCE,Frontier Asset U.S. Large Cap Equity ETF,stocks,us,ARCX,ETF,True,usd,BBG01RB9SY84,BBG01RB9SZ72,2025-12-01T07:05:47.196093245Z,
FLCG,Federated Hermes MDT Large Cap Growth ETF,stocks,us,ARCX,ETF,True,usd,BBG01NKB1C49,BBG01NKB1D38,2025-12-01T07:05:47.196093365Z,0001849998
FLCH,Franklin FTSE China ETF,stocks,us,ARCX,ETF,True,usd,BBG00J3MD154,BBG00J3MD1W4,2025-12-01T07:05:47.196093485Z,0001655589
FLCO,Franklin Investment Grade Corporate ETF,stocks,us,ARCX,ETF,True,usd,BBG00DVZWNP6,BBG00DVZWNQ5,2025-12-01T07:05:47.196093595Z,0001655589
FLCV,Federated Hermes MDT Large Cap Value ETF,stocks,us,ARCX,ETF,True,usd,BBG01NK8CP18,BBG01NK8CPX3,2025-12-01T07:05:47.196093715Z,0001849998
FLD,"Fold Holdings, Inc. Class A Common Stock",stocks,us,XNAS,CS,True,usd,BBG0142PTRC8,BBG0142PTS63,2025-12-01T07:05:47.196093836Z,0001889123
FLDB,Fidelity Low Duration Bond ETF,stocks,us,XNAS,ETF,True,usd,BBG01LH0LYH7,BBG01LH0LZB0,2025-12-01T07:05:47.196093956Z,0001562565
FLDDW,"Fold Holdings, Inc. Warrant",stocks,us,XNAS,WARRANT,True,usd,BBG0154LPFW0,,2025-12-01T07:05:47.196094086Z,0001889123
FLDR,Fidelity Low Duration Bond Factor ETF,stocks,us,BATS,ETF,True,usd,BBG00L4J99Z0,BBG00L4J9BR4,2025-12-01T07:05:47.196094206Z,0001562565
FLDZ,RiverNorth Patriot ETF,stocks,us,BATS,ETF,True,usd,BBG01VJKDP41,BBG01VJKDQ76,2025-12-01T07:05:47.196094347Z,0001776878
FLEE,Franklin FTSE Europe ETF,stocks,us,ARCX,ETF,True,usd,BBG00J3PR1S7,BBG00J3PR2H7,2025-12-01T07:05:47.196094477Z,0001655589
FLEU,Franklin FTSE Eurozone ETF,stocks,us,ARCX,ETF,True,usd,BBG00J3PR6Q8,BBG00J3PR7F8,2025-12-01T07:05:47.196094607Z,0001655589
FLEX,Flex Ltd. Ordinary Shares,stocks,us,XNAS,CS,True,usd,,,2025-12-01T07:05:47.196094717Z,0000866374
FLG,"Flagstar Bank, National Association",stocks,us,XNYS,CS,True,usd,BBG000BVXPZ8,BBG001SD32Z2,2025-12-01T07:05:47.196094998Z,0000910073
FLGB,Franklin FTSE United Kingdom ETF,stocks,us,ARCX,ETF,True,usd,BBG00J3PQYB4,BBG00J3PQZ12,2025-12-01T07:05:47.196095118Z,0001655589
FLGC,Flora Growth Corp. Common Stock,stocks,us,XNAS,CS,True,usd,BBG00Z85YJH5,BBG00Z85YKB8,2025-12-01T07:05:47.196095268Z,0001790169
FLGR,Franklin FTSE Germany ETF,stocks,us,ARCX,ETF,True,usd,BBG00J3MNNR1,BBG00J3MNPG8,2025-12-01T07:05:47.196095409Z,0001655589
FLGT,"Fulgent Genetics, Inc. Common Stock",stocks,us,XNAS,CS,True,usd,BBG00DR7LTG2,BBG00DW0QQM5,2025-12-01T07:05:47.196095529Z,0001674930
FLGV,Franklin U.S. Treasury Bond ETF,stocks,us,ARCX,ETF,True,usd,BBG00V7V3M12,BBG00V7V3MT2,2025-12-01T07:05:47.196095649Z,0001655589
FLGpA,"Flagstar Bank, National Association Depositary shares, each representing a 1/40th interest in a share of Fixed-to-Floating Rate Series A Noncumulative Perpetual Preferred Stock",stocks,us,XNYS,PFD,True,usd,,,2025-12-01T07:05:47.196095789Z,0000910073
FLGpU,"Flagstar Bank, National Association Bifurcated Option Note Unit SecuritiES",stocks,us,XNYS,SP,True,usd,,,2025-12-01T07:05:47.19609593Z,0000910073
FLHY,Franklin High Yield Corporate ETF,stocks,us,BATS,ETF,True,usd,BBG00L2CL634,BBG00L2CL6V3,2025-12-01T07:05:47.1960963Z,0001655589
FLIA,Franklin International Aggregate Bond ETF,stocks,us,BATS,ETF,True,usd,BBG00L2CLBL3,BBG00L2CLCB2,2025-12-01T07:05:47.196096461Z,0001655589
FLIN,Franklin FTSE India ETF,stocks,us,ARCX,ETF,True,usd,BBG00JYWBHT9,BBG00JYWBLK9,2025-12-01T07:05:47.196096631Z,0001655589
FLJH,Franklin FTSE Japan Hedged ETF,stocks,us,ARCX,ETF,True,usd,BBG00J3MMYR8,BBG00J3MMZG7,2025-12-01T07:05:47.196096771Z,0001655589
FLJJ,AllianzIM U.S. Equity 6 Month Floor5 Jan/Jul ETF,stocks,us,ARCX,ETS,True,usd,BBG01L88DQ13,BBG01L88DQW9,2025-12-01T07:05:47.196096911Z,0001797318
FLJP,Franklin FTSE Japan ETF,stocks,us,ARCX,ETF,True,usd,BBG00J3MDY16,BBG00J3MDYR8,2025-12-01T07:05:47.196097022Z,0001655589
FLKR,Franklin FTSE South Korea ETF,stocks,us,ARCX,ETF,True,usd,BBG00J3N5BB2,BBG00J3N5C11,2025-12-01T07:05:47.196097152Z,0001655589
FLL,"Full House Resorts, Inc.",stocks,us,XNAS,CS,True,usd,BBG000BHSGF7,BBG001S7D9G0,2025-12-01T07:05:47.196097282Z,0000891482
FLLA,Franklin FTSE Latin America,stocks,us,ARCX,ETF,True,usd,BBG00M6PPS91,BBG00M6PPT17,2025-12-01T07:05:47.196097402Z,0001655589
